name;domain;description;sdgs;cover_image_id;street_address;Latitude;Longitude;
UpLift - Hybrid Energy System;klimaschutzpartner-berlin.de;UpLift ist ein neuartiges Hybrid-System, das die Nutzung von Sonnen- und Windenergie miteinander kombiniert und damit die effiziente sowie nachhaltige Gewinnung erneuerbarer Energien im urbanen Raum ermöglicht. Der Ausbau erneuerbare Energien ist essenziell für eine erfolgreiche Energiewende, was in Städten aufgrund der komplexen Anforderungen und dichten Bebauung bislang sehr eingeschränkt möglich war. Dachflächen bieten hier ein bislang weitgehend ungenutztes Potenzial. Aufgrund der großen verfügbaren Fläche sowie der vorteilhaften Lage sind sie besonders gut für die lokale Produktion erneuerbarer Energien in Städten geeignet. Hier liefern nicht nur Solaranlagen mehr Ertrag durch weniger Verschattung und einen besseren Einfallswinkel, sondern auch die Windgeschwindigkeiten werden aufgrund der Strömungsablösungen an Dachkanten stark kanalisiert wodurch diese stark steigen können. Um diese Möglichkeiten für die urbane Energiegewinnung nutzbar zu machen, wurde das modulare Hybrid-System UpLift entwickelt. Ein Modul hat eine Grundfläche von vier Quadratmetern und wird vorrangig auf Flachdächern kurz hinter der Dachkante platziert. Die Konstruktion besteht im wesentlichen aus zwei großen und zwei kleinen Solarmodulen, einer Windturbine, Stützkonstruktion, einem Generator und dem Power Unit. Das System kann einfach und schnell installiert werden, wobei keine Fachkräfte für die Montage benötigt werden. Die Integration der Solarmodule in die Konstruktion ermöglicht eine effizientere Flächen- und Ressourcennutzung. Für die erfolgreiche Energiewende kann das System modular erweitert und so die Energiegewinnung bedarfsorientiert skaliert werden. Durch die Kombination der Nutzung von Wind- und Sonnenenergie werden kann ein Modul im Ganzjahresbetrieb ungefähr 1.000 Kilowattstunden Strom aus erneuerbaren Energien erzeugen. Anteilig kommen etwa 250 Kilowattstunden von der Windkraftanlage und 750 Kilowattstunden von den vier Solarmodulen. Je nach Standort können die Sonneneinstrahlung sowie die verfügbaren Windgeschwindwindigkeiten variieren, was den Ertrag steigern oder senken kann. Für die Großstadt Berlin beispielsweise kann UpLift bei Flächendeckender Nutzung mit einem Ertragspotenzial von etwa 6,25 Terrawatt bei 2.500 Hektar nutzbarer Dachfläche anteilig bis zu 45% der Stromversorgung durch die lokale Energiegewinnung der Hauptstadt beisteuern. Durch die klare Gestaltung und neue Flächennutzung fügt sich die Anlage harmonisch in verschiedenste Stadtbilder ein und bietet durch die Sichtbarkeit weitere Potenziale für eine erfolgreiche Energiewende, wie durch die Partizipation der BewohnerInnen. Die Modularität des Hybrid-Systems UpLift ermöglicht die Skalierbare Anwendbarkeit und Integration von erneuerbaren Energien in Städten. Das System kann nicht nur sämtliche Flächenpotenziale dank der kompakten Bauform nutzen, sondern auch die Energiegewinnung bedarfsorientiert angepasst werden. Städte können somit heute schon zu Kraftwerken der Zukunft umgestaltet werden und ihren Beitrag für die erfolgreiche Umsetzung der Energiewende leisten. Aber auch abseits von Dachflächen kann UpLift unter anderem aufgrund der einfachen Konstruktion und flexibler Platzierungsmöglichkeiten für die erfolgreiche Erzeugung erneuerbarer Energie betrieben werden. Gegebenenfalls kann das System neben der modularen Anordnung um Speichertechnologien, zusätzliche Solarmodule oder eine höhenverstellbarer Windturbine erweitert werden. Auch verschiedene Akzentfarben können ja nach Platzierung gewählt werden um die Akzeptanz und Sichtbarkeit je nach Umgebung zu optimieren.;7, 9, 11, 13;platform/organizations/covers/n5rxdbr0kkxogsgztzwk;Flensburger Straße 10, 10557 Berlin;;;
Neubau Werkstattgebäude Konrad-Zuse-Schule;klimaschutzpartner-berlin.de;"ZENTRALE ENTWURFSGEDANKEN – Schulgebäude nachhaltig bauen Der Neubau des Werkstattgebäudes besticht durch sein konsequentes Nachhaltigkeitskonzept. Kerngedanke ist, ein Gebäude zu entwickeln, welches auf sich verändernde Raumanforderungen und Umwelteinflüsse reagieren kann. Entstanden ist eine modulare Konstruktion mit einer großen Stützweite, die für zukünftige Umnutzungen ein hohes Maß an Flexibilität bietet. Das Haus ist als reiner Holzbau unter Einsparung aufwendiger Gebäudetechnik errichtet – mit minimalem ökologischem Fußabdruck. Das Konzept, nachwachsende Baustoffe mit einer robusten und einfachen Bauweise zu kombinieren, hat Pilotcharakter in der Umsetzung von Schulbauten. Die sichtbare Verwendung natürlicher Materialien präsentiert zudem die nachhaltige Bauweise und macht den Baustoff Holz für die Nutzer:Innen erlebbar. ARCHITEKTUR – Weiterbauen und Weiterdenken Die Konrad-Zuse-Schule ist eine Berufsschule mit sonderpädagogischem Schwerpunkt; sie gilt außerdem als Pilotschule für Inklusion. Durch den zweigeschossigen Neubau konnten die bisherigen, nicht mehr auskömmlichen Werkstatteinrichtungen ersetzt werden. Das neue Gebäude steht im vorderen Bereich des Schulgrundstücks, ist aber durch seine schlichte Form als Nebengebäude klar ablesbar. Zur Straße hin öffnet sich das neue Haus mit einem großen „Schaufenster“ und erlaubt so Einblicke in den Schulbetrieb. Die Werkstätten orientieren sich über eine Bandfassade zum Pausenhof. Der ebenerdige Zugang erfolgt rückwärtig über eine gemeinsame überdachte Eingangszone mit dem bestehenden Schulgebäude. MATERIAL UND FUNKTION – Holz erlebbar machen Im Kontrast zur einfachen Form des Baukörpers steht die reliefartige Fassadenbekleidung, die im Tages- und Sonnenverlauf eine lebendige Struktur bildet. Sie besteht aus karbonisierten Fichtenholzlamellen. Diese jahrhundertealte Art Holz zu beflammen stammt aus Japan und ermöglicht, auf eine chemische Imprägnierung zu verzichten. Im Gegensatz zur dunklen Holzfassade außen sind die Holzoberflächen im Innenraum in hellen Tönen gehalten. Die Dimensionierung der tragenden und aussteifenden Bauteile auf Abbrand, klare Wegeführung und Gliederung der Nutzungseinheiten machte es möglich, die Holzelemente durchgehend sichtbar zu belassen. Das Holz schafft mit seiner warmen Oberfläche eine angenehme Lernatmosphäre und sorgt für ein ausgeglichenes Raumklima. Im EG sind die Werkstätten sowie die Haustechnik, Lagerflächen und der Bauhof untergebracht. Im OG befinden sich weitere Werkräume und zwei Unterrichts-Gruppenräume, sowie rückwärtig die Umkleide- und Sanitärbereiche. KONSTRUKTION – Einfach und flexibel Die offene Skelett–Bauweise mit einem Achsmaß von 9 m und einer Deckenspannweite von 4,5 m ermöglicht eine flexible Nutzung. Der Baukörper ist nicht unterkellert und ab Oberkante Bodenplatte als reiner Holzbau errichtet. Das Tragwerk basiert auf einem Stecksystem und wurde aus massiven Holzstützen und Unterzügen sowie Massivholzdecken und Innenwänden aus Brettsperrholz erstellt. Die Holzteile wurden im Werk vorgefertigt und vor Ort montiert. So konnte die Erweiterung im laufenden Unterrichtsbetrieb mit minimaler Beeinträchtigung errichtet werden. Die Außenhülle bilden hochdämmende nicht tragende Holzrahmenbauelemente. Auch das Dämmmaterial in Form von Zellulose besteht aus nachwachsenden Rohstoffen. KLIMAKONZEPT – Weniger ist mehr Durch die diffusionsoffene Bauweise und die natürliche Fensterlüftung wird die Raumluftfeuchte und die Innenraumtemperatur gesteuert. Es kann so auf teure und wartungsintensive Technik wie Lüftungs- und Klimaanlagen verzichtet werden. Diese Maßnahmen werden durch eine hochdämmende Gebäudehülle, einen angemessenen Glasanteil und Verschattungselemente ergänzt und ermöglichen über das ganze Jahr einen geringen Energiebedarf. Durch den Einsatz regenerativer Energiequellen (Luft-Wärmepumpe) kann ein hoher Anteil des Wärmebedarfes gedeckt werden. Auf dem Flachdach kann eine Photovoltaikanlage nachgerüstet werden.";4, 7, 11, 13;platform/organizations/covers/cwznkcsfclrvm0gddnli;Hermann-Hesse-Straße 34, 13156 Berlin;;;
Mall of BR;klimaschutzpartner-berlin.de;"Die BR befindet sich im Veränderungsprozess und auf Wachstumskurs. Fortschreitende Digitalisierung, komplexere Anforderungen unserer Kunden und Chancen-orientierte Markterweiterung erfordern ein erhöhtes Maß an Flexibilität, Kreativität und Mut von unseren Mitarbeiter:innen und von uns als Arbeitgeberin. Trends wie mobiles Arbeiten, sinnstiftendes Arbeiten und Fachkräftemangel stellen zusätzliche Anforderungen an den Arbeitsplatz der Zukunft. Mit dem nachhaltigen Upcycling unserer Fahrzeughalle - in einen modernen und flexiblen Bürokomplex - setzten wir unsere Soll Kultur und unsere strategische Ausrichtung mittels Architektur unmittelbar um und gehen so den nächsten Schritt in Richtung einer nachhaltigen Entwicklung der BR. Der entstehende Bürokomplex sieht neben 64 großräumigen, modernen Arbeitsplätzen diverse Coworking-Bereiche vor, so dass Mitarbeiter:innen zwischen Bürostuhl, Loungesessel, Terassenstuhl und Stehtischen bedarfsgerecht wählen können. Viel Holz und Pflanzen, ein abgestimmtes Licht- und Akkustikkonzept, Photovoltaig und Sole-Wärmepumpe sorgt für ein angenehmes Arbeitsklima in anregender Atmosphäre. Die zukünftige Nutzung ermöglicht Konzentration, Kommunikation, Kooperation, Kreativität, aber auch Pausen und Veranstaltungsaktivitäten mit Internen, wie mit Externen. Die ""Mall of BR"" setzt Maßstäbe für nachhaltige Architektur und moderne Arbeitswelt. Die Umwandlung einer alten Fahrzeughalle betont Umweltverantwortung und Wertschätzung der Standortgeschichte. Upcycling par excellence: Alte Dachpfetten, Stahlkonstruktion und Mauern wurden sorgfältig wiederverwendet, als Hommage an die Geschichte des Ortes. Akustik trifft Stil: Holzwolle-Leichtbauplatten schaffen eine angenehme Arbeitsatmosphäre und verleihen dem Raum eine einzigartige Ästhetik. Grüne Technologie und Stilfusion: Umweltfreundliche Wärmepumpe, PV-Anlage und natürliche Lüftung unterstreichen die nachhaltige Gestaltung. Vintage Vibes und Recycled Chic: Einrichtung mit Upcycling-Materialien, recyceltem Granulat im Terrazzo-Boden und 100% recyceltem Polyamidgarn im Teppichboden betonen den nachhaltigen Ansatz. Smarte Energie und flexible Nutzung: Effiziente Beleuchtung mit Präsenzmeldern und modulare Raumstrukturen bieten einen zukunftsorientierten Arbeitsplatz. Die ""Mall of BR"" – mehr als ein Büro, ein Ort der Inspiration, Kreativität, Geschichte und ökologischer Verantwortung.";7, 9, 11, 12, 13;platform/organizations/covers/jiwu3yvbyjrs0xhtqavu;Monumentenstraße 14, 10829 Berlin;;;
Separate (Zweikreis) Wasseraufbereitung;klimaschutzpartner-berlin.de;Aus eigenen Beobachtungen und nach mehreren Experimenten, bin ich zu Ergebnis gekommen, dass praktisch jeder von uns täglich ca.30-50% Trinkwasser einfach im Klo herunter spült.Das liegt in wesentlichen daran, dass das gesamte Abwasser unabhängig vom Verschmutzung Grad lediglich in ein Abwassersystem abgeleitet wird.Auch in betrieblichen Bereichen für technische Produktionszwecken in denen große Mengen sauberen Wassers gebraucht werden,wird häufig Trinkwasser eingesetzt, obwohl dieses in seinem Reinheitsgrad für den Zweck oft überqualifiziert ist.In der Konsequenz wird ein großer Teil des stark verschmutzten Brauchwassers wieder dem Abwasser zugeführt.Starke Verschmutzungen des Abwassers durch technische,aber auch bakterielle Belastungen (z.B. durch Fäkalien) machen die Abwasserreinigung hin zu adäquaten Trinkwasser teuer und kompliziert,in vielen Fällen kann das Wasser nicht zu 100% gereinigt und von Schadstoffen befreit werden und wird zudem in diesen Zustand häufig in offene Gewässer abgeleitet. Das hat mich auf Idee gebracht das relativ saubere Wasser von verschmutztes Wasser zu trennen und da mit die Belastung der Natur deutlich zu reduzieren.Die Idee besteht daraus das Wasser in zwei, voneinander unabhängigen, Kreisläufen zu nutzen und zu reinigen.Dieses System ermöglicht es ca. 50-70% an Trinkwasser zu sparen und Abwasser mit hohem Verschmutzung Grad bis 100% reduzieren. In Trinkwasser Kreislauf wird nur Wasser mit Trinkqualität geführt.Es ist geeignet für Körperpflege,zur Essenszubereitung, und um Geschirr und Wäsche mit umweltfreundliche Waschmitteln zu waschen.Dieses nur leicht verschmutzte Wasser wird in normalen Kläranlagen gereinigt (Num.2 auf dem Bild).Nach diesem Reinigung wird das Wasser zu erst zu Regenerationsanlage(Num.4 auf dem Bild)geleitet und danach für zusätzliche Reinigung durch natürlichen Sand, Aktivkohle oder anderen Absorber geführt, erst dann wird es weiter in freien Gewässer geführt(Num.5 auf dem Bild). Das technische Wasser bleibt immer in geschlossenen Kreis und verlässt diesen nur im Dampfzustand.Technisches Wasser wird für Toilettenspülung und Autowäsche genutzt und in verschiedenen technischen Betriebe in der Produktion eingesetzt(selbstverständlich nicht für die Lebensmittel, Medikamentenherstellung oder ähnliche Zwecke).Es ist außerdem geeignet zur Stromerzeugung, Metall Kühlung,Baustoffen Herstellung, für Heizungsanlagen und für andere technische Zwecke...Dises Wasser kann mit aggressiven Methoden wie chemische Reaktionen, Starkstrom, oder anderen ähnlichen Mitteln bis zu entsprechenden Standartnormen gereinigt werden(Num.3 auf dem Bild).Dieses Wasser kann für zusätzliche Sicherheit auch mit leichtem Duft, Farbe und unangenehmen Geschmack versehen werden, bevor es ins System geleitet wird.Leitungen,Hähne und anderen Zubehör in diesem Kreislauf werden auf bestimmte Standartnormen gefertigt, sodass ein anschließen an den Trinkwasserkreis unmöglich gemacht wird. Zusätzlich zu beiden Kreisläufen muss das Regenwasser aus den Städten von Verschmutzungen wie unter anderem von Autoöl, Schwermetallen, Mikropartikel aus Autoreifen, chemische Reagenten und anderen Verschmutzungen gereinigt werden. Gereinigtes Regenwasser wird auch durch Regenerationsanlage(Num.4 auf dem Bild)geleitet und nur dann kommt zu offene Gewässer(Num.5 auf dem Bild).;6, 7, 9, 13;platform/organizations/covers/ccf1hzxvyjgloelqho6e;Neue Jüdenstraße 1, 10179 Berlin;;;
Museums-Pavillon & Touristische Wissenspfade, TU Berlin;klimaschutzpartner-berlin.de;Neubau Museums-Pavillon – Reallabor für das Planen und Bauen innerhalb der planetaren Grenzen Das GRW-Projekt „Museums-Pavillon und Touristische Wissenspfade“ ist ein Forschungs- und Bauvorhaben der Technischen Universität Berlin und des Bezirks Berlin Charlottenburg-Wilmersdorf. Durch klimaangepasstes Design, die Entwicklung zirkulärer Bausysteme unter Einsatz von wiederverwendeten Rohstoffen sowie eines adaptiven LowTech-Konzepts entsteht ein klima- und ressourcenpositives Gebäudeprinzip für einfaches, schadstofffreies Bauen aus Holz mit schlanker Gebäudetechnik, das Abfall fast gänzlich vermeidet. Auf Basis dieser Prinzipien soll das Gebäude einen positiven Beitrag zum Klimaschutz leisten und vom Ressourcenvernichter zum Ressourcenerhalter werden. Als Reallabor für das Planen und Bauen in den planetaren Grenzen werden innovative und experimentelle Lösungen entwickelt und umgesetzt, das Projekt basiert auf und kooperiert mit Forschungen verschiedener Fachgebiete der TU Berlin. Zur Erreichung der Klima- und Ressourcenziele im Bauwesen bis 2050 bedarf es dringend methodischer Ansätze für Innovationsschübe in allen Bereichen - von der Material- und Konstruktionsentwicklung bis zur kreislaufgerechten Konzeption und Anpassungsfähigkeit von ganzen Gebäuden. Hier kommt der Wiederverwendung von Altholz aus Bau- und Abbruchabfällen in Deutschland eine Schlüsselrolle zu. Trotz des steigenden Bedarfs an Schnittholz wird Altholz (Holz aus Bau- und Abbruchabfällen) primär in einer abwertenden Nutzungskaskade thermisch (79%) oder stofflich (15%) verwertet. Eine Wiederverwendung im Bauwesen ohne Zerkleinerung als tragende Bauteile findet kaum statt. Im Fokus des Forschungs- und Bauvorhabens steht die Entwicklung von Strategien zur Gewinnung, Beurteilung und Einsatz von Altholz in Tragkonstruktionen, durch zerstörungsfreie Rückbaustrategien, sowie Ableitung alternativer Sortierklassen. Die angepasste Planung sieht ein reversibles und stahlarmes, additives Tragsystem mit optimierten Querschnitten vor, basierend auf dem Einsatz von Altholz. Die 12 m spannenden Gitterträger aus Altholz werden zum gestalterischen Element und für das Vorhaben wird eine Recyclingquote von 100% angestrebt. Durch Kooperation von Forschung und Praxis, neuer Wertschöpfungsketten und alternativer Werkzeuge der Planung, kann flexibel auf bestehende Materialpools reagiert und zukunftsweisend und kreislaufgerecht geplant werden. Das Museum wird als adaptives LowTech Gebäude konzipiert und zum zukunftsweisenden Pilotprojekt für nachhaltige Museen. Anstelle von hoch technisierter Standard-Ausstattung wird ein adaptives Betriebssystem entwickelt. Ein angemessener Glasanteil und nachhaltige Textilfassade vermitteln ganzjährig im Spannungsfeld zwischen optimalem Wärmeschutz im Winter, unerwünschten Gewinnen im Sommer, Tages- und Kunstlicht. Klimasteuernde Materialien wie Lehm, Naturfaserdämmung und Holz ermöglichen die Reduzierung des Lüftungs- und Klimatisierungsbedarfes auf ein Minimum. Auf diese Weise werden aktuell etablierte, technikzentrierte Standards im Bauwesen hinterfragt und auf Lüftungs- und Klimatechnik verzichtet. Zunehmend komplexe Anforderungen an das Planen und Bauen im Gebäudebereich führen in der Praxis zu vielfältigen Akteurskonstellationen, sowie Abläufen und Interdependenzen. Die notwendigen Innovationen im klimagerechten Bauen werden in der Praxis dadurch häufig erschwert und spezifisch gewonnenes Wissen bleibt lokal in einzelnen Projekten gebunden. Das Projekt „Museums-Pavillon und Touristische Wissenspfade“ wurde in einem kollaborativen, partizipativen Prozess aus der Universität heraus erarbeitet. In Kooperation mit einem transdizsiplinären Fachbeirat, erarbeitete ein studentisches Projektbüro die konzeptionelle Vorplanung. Im April 2022 wurde diese an ein kollaboratives Planer*innenteam aus Architekt*innen, Landschaftsarchitekt*innen, Fachplaner*innen und Ausstellungsgestalter*innen übergeben die das Vorhaben weiter planen und bis 2027 realisieren.;4, 9, 11, 13;platform/organizations/covers/omcppzl4acgbw7uspzzb;Ackerstraße 76, 13355 Berlin;;;
Klimabeschichtung in Altbauwohnung - Heizenergie sparen ohne zu frieren;klimaschutzpartner-berlin.de;Die Mieterin einer unsanierten Berliner Altbauwohnung fror seit Jahren in ihrer Wohnküche. Weder die Heizung auf 21-22°C eingestellt noch zwei Paar Socken konnten Frösteln und dauerhaft kalte Füße vermeiden. Nach einem Anstrich der Wohnküche Im September 2022 mit Klimafarbe aus der ClimateCoating Serie konnte die Mieterin sofort den Thermostat auf 18,5°C drosseln und fühlte sich trotzdem das erste Mal in der kalten Jahreszeit von Kopf bis Fuß wohlig und warm. Die Einstellung der Heizung auf 18,5°C wurde den ganzen Winter über beibehalten und das dauerhafte Wärmegefühl wurde mehrfach bestätigt. Kalte Füße waren seit dem Anstrich nie mehr zu beklagen - und das auch ohne zwei Paar Socken.;7, 11, 13;platform/organizations/covers/vukxwjive6llplq6ybre;Karlsbergallee 20, 14089 Berlin;;;
Nahwärmeversorgung Eichkamp;klimaschutzpartner-berlin.de;Neuerrichtung eines Nahwärmenetzes frei von fossilen Energien im kleinteiligen Gebäudebestand im großstädtischen Umfeld. Aufbau und Betrieb der Anlage in der Hand der Bürgerinnen und Bürger als Energiegenossenschaft. Die Anwohnerinnen und Anwohner der Siedlung beabsichtigen die Gründung einer Genossenschaft, um ihre Häuser mit klimafreundlicher erneuerbarer Wärme zu versorgen und ihre Öl- und Gasheizungsanlagen abzuschaffen. Die zukünftige Genossenschaft errichtet und betreibt eine Wärmeerzeugungsanlage auf Basis von Großwärmepumpen und ergänzender Wärmeerzeugung für Spitzenlasten sowie die Verteilung der Wärme in der Siedlung mit einem neuen Wärmenetz. Die in der Siedlung liegenden Gebäude des Bezirksamtes können ebenfalls mitversorgt werden. Die Planungen sind weit vorangeschritten: Über 100 Anwohnende haben Ihren Willen zum Anschluß an das zukünftige Wärmenetz bekundet, die technische Planung ist derzeit auf dem Niveau der Entwurfsplanung. Ein Businessplan wird entwickelt, erste Bankgespräche wurden geführt. Eine Genossenschaftssatzung liegt im Entwurf vor. Die Gründung der Genossenschaft ist für Sommer 2023 avisiert. Es handelt sich um eine einzigartige Zusammenarbeit zwischen einem Berliner Bezirksamt (Bezirksamt Charlottenburg-Wilmersdorf) und einer Bürgerenergiegenossenschaft, die in Kürze gegründet wird - Wärmegenossenschaften sind bislang nur im ländlichen Raum verbreitet. Diese Zusammenarbeit hat einen bezifferbaren Mehrwert für den Klimaschutz: Sie spart 1000 t CO2 im Jahr ein. Eine Zahl, die weder das Bezirksamt noch das Quartier für sich allein erreichen könnten. Das Bezirksamt unterstützt die zukünftige Genossenschaft durch umfangreiche Vorarbeiten wie die Beauftragung von Ingenieurbüros für Planungsleistungen und Finanzierung einer Sanierungsmanagerin, die die Projektentwicklung intensiv mit den Anwohnenden vorantreibt. Finanzielle Unterstützung leisten die Senatsverwaltung für Umwelt, Mobilität, Verbraucher- und Klimaschutz und die KfW Kommunalbank.;7, 11, 13;platform/organizations/covers/ppwyugvuqa97t1n0qeqw;Zikadenweg 42A, 14055 Berlin;;;
Jugendstil - nachhaltig und bescheiden;klimaschutzpartner-berlin.de;Der nahezu unverbaute Altbau von 1915 mit einzelnen schönen Jugendstil-Elementen stand nicht unter Denkmalschutz und war somit zum Abriss und Neubau freigegeben. Das Gebäude nutzt das Grundstück nur sehr dürftig aus, die Grundrisse der beiden Etagen mit knapp 125m2 sind ungünstig für die vierköpfige Familie geschnitten. Der erste Gedanke galt entsprechend einem Neubau. Der Gedanke wurde bald verworfen, denn ein Abriss und der damit verbundene Müll erschein den Bauherrn und uns unverhältnismäßig und unzeitgemäß. Darüber hinaus hatten wir uns mittlerweile in das kleine Haus verliebt. Im nächsten Step wurden die Varianten Aufstockung und Anbau untersucht. Dann kam die Pandemie. Das Nachdenken über die Ursache dieser Pandemie - die immer stärkere Ausbreitung von uns Menschen auf dem Planeten, das Streben nach immer mehr mit den unübersehbaren Folgen für das Klima und die Natur, die weiter zurückgedrängten Lebensräume für Tiere, diese auf den Menschen zurückspringenden Zoonose namens Corona - bewegte uns zu Demut und zu einer Rückbesinnung auf das Wesentliche. Unter dem ganzheitlichen Ansatz sich flächenmäßig auf den Bestand zu beschränken, soviel Bausubstanz wie möglich zu erhalten und zu reparieren, weitestgehend Baustoffe und Materialien zu verwenden, die sortenrein, kreislauffähig und gesund sind und die Haustechnik auf regenerative Energien auszurichten ist ein leises und bescheidenes, aber beispielgebendes Projekt entstanden, das aufzeigt wie mit wenigen Mitteln nachhaltige Sanierung unseres Gebäudebestandes der Jahrhundertwende gelingen kann.;11, 12, 13;platform/organizations/covers/l2imhde0mcgfu4kdfdx8;Marchlewskistraße 34, 10243 Berlin;;;
