name;domain;description;sdgs;cover_image_id;street_address;Latitude;Longitude;
Acker – Mehr Wertschätzung für Natur und Lebensmittel;acker.co;Mehr Wertschätzung für Natur und Lebensmittel – dafür setzt sich Acker im gesamten deutschsprachigen Raum ein. Mit seinen vielfach ausgezeichneten Bildungsprogrammen GemüseAckerdemie und AckerRacker etabliert das Sozialunternehmen den Gemüseacker als naturnahen Lernort strukturell im Bildungsalltag von Schulen, Kitas und Kindergärten. Zusammen mit den Partnerorganisationen in Österreich, der Schweiz und Liechtenstein begeistert Acker junge Menschen im gesamten deutschsprachigen Raum für Natur und Nachhaltigkeit: Mehr als 70.000 Kinder und Jugendliche an rund 1.600 Lernorten in ganz Deutschland, Österreich, der Schweiz und Liechtenstein bauen 2024 mit unseren Programmen ihr eigenes Gemüse an. Mit praktischen Bildungsangeboten für Erwachsene trägt Acker seine Mission auch in Unternehmen, Mieterschaften und Privathaushalte. Das Sozialunternehmen arbeitet mit rund 200 Mitarbeiter*innen und rund 500 ehrenamtlichen Helfer*innen wirkungsorientiert und wissenschaftlich fundiert an der Schnittstelle von Bildung, Landwirtschaft, Umwelt und Ernährung. Unterstützt wird Acker dabei von starken Partnern wie Stiftungen, Unternehmen, Ministerien, Spender*innen und Organisationen. Acker hat für seine Bildungsprogramme bereits vielfache Auszeichnungen erhalten, unter anderem die nationale Auszeichnung „Bildung für Nachhaltige Entwicklung“ der Deutschen UNESCO-Kommission, den Deutschen Nachhaltigkeitspreis sowie denBundespreis Verbraucherschutz. Die Bildungsprogramme von Acker In den Bildungsprogrammen von Acker bauen Kinder und Jugendliche ihr eigenes Gemüse an – direkt an der Schule, Kita oder im Kindergarten. Auf der eigenen Ackerfläche oder in Indoor-Beeten im Klassenzimmer erleben sie, woher das Essen auf ihren Tellern kommt und wie lecker frisches Gemüse schmeckt. Die betreuenden Pädagog*innen unterstützt Acker mit vielfältigen Bildungs- und Begleitmaterialien, Fortbildungen und tatkräftiger Hilfe vor Ort. Das Herzstück der Wissensvermittlung: Die Acker-Lernplattform, auf der detaillierte (Video-)Anleitungen, individuelle Anbaupläne, wöchentlich aktuelle Tipps zur Ackerpflege und umfangreiche Bildungsmaterialien für alle Altersstufen zur Verfügung stehen. So verknüpfen die Bildungsprogramme von Acker den praktischen Gemüseanbau mit theoretischer Wissensvermittlung rund um gesunde Ernährung, Natur und Nachhaltigkeit, treiben die Digitalisierung der Bildungslandschaft voran und verankern Bildung für nachhaltige Entwicklung (BNE) im Lernalltag von Kitas, Kindergärten und Schulen. AckerRacker Im mehrjährigen Bildungsprogramm AckerRacker entdecken Kitakinder die Natur mit allen Sinnen. Auf dem eigenen Acker erleben sie, wie aus kleinen Samen und Pflänzchen leckeres Gemüse wird. ackerracker.de | ackerracker.at | ackerracker.ch GemüseAckerdemie In der vielfach ausgezeichneten GemüseAckerdemie bauen Schüler*innen ihr eigenes Gemüse an. Sie begreifen natürliche Zusammenhänge und erfahren, wie viele Ressourcen in frischen Lebensmitteln stecken. gemueseackerdemie.de | gemueseackerdemie.at | gemueseackerdemie.ch | gemueseackerdemie.li GemüseKlasse 3 Beete – 1 Klassenzimmer – viel frisches Gemüse: In der GemüseKlasse bauen Kinder direkt im Klassenraum ihre eigenen Gemüse- und Kräuterpflanzen an und erleben unmittelbar, wie Lebensmittel natürlich wachsen. gemueseklasse.de Angebote für Erwachsene Mit seinen vielfältigen Angeboten für Erwachsene trägt Acker seine Mission auch in Unternehmen, Mieterschaften und Privathaushalte sowie in die Ausbildung zukünftiger Pädagog*innen. CampusAckerdemie Die CampusAckerdemie bringt Gemüseanbau und BNE in die Hochschule: Auf dem eigenen CampusAcker lernen zukünftige Pädagog*innen alles, was sie wissen müssen, um später selbst einen Lehrgarten zu betreuen. campusackerdemie.de Ackerpause Das Office-Gardening- und Urban-Farming-Konzept Ackerpause bringt Gemüsebeete in Büros und Nachbarschaften. So können Angestellte und Mieter*innen den Gemüseanbau in ihren Lebensalltag integrieren. ackerpause.de „Ran ans Gemüse!“ Der Mitmach-Newsletter „Ran ans Gemüse!“ inspiriert Privatpersonen zum Gärtnern, Kochen, Basteln, Lernen und mehr. Gesunde Ernährung und nachhaltiger Konsum stehen dabei ebenso im Fokus wie Wissenswertes rund um Gemüse, Umwelt und Naturschutz.;2, 3, 4, 11, 12, 13, 15;platform/organizations/covers/k2caxr3og9e67fsmyjlo;Malzfabrik, Bessemerstraße 2-14, 12103 Berlin;;;
Alterocentric Impact Promoter Score;alterocentric.foundation;"Established in 2024, the Research Institute of Altrocentric Business Ethics is a non-profit organization dedicated to the promotion of science and research in the field of altrocentric business ethics. The purpose of the statutes is realized in particular by the supervision of students in the preparation of academic papers and the awarding of scholarships; the realization of non-commercial research projects; and the production and publication of monographs and periodicals. The foundation is devoted to foster the dialogue on values and ethical business behaviour based on an alterocentric vision. It fosters intellectual independence and strives to reflect and envision the dynamic yet values-based world we live in. https://alterocentric.foundation/foundation.htm";8;platform/organizations/covers/qwxg5iuln23pkstgegim;Schönhauser Allee 98, 10439 Berlin;;;
.GUT Am Flughafen 1;amflughafen1.de;Republic und dem Schumacher Quartier ein Quartier für die Stadt der Zukunft. .GUT Am Flughafen 1 macht den Anfang für diese Entwicklung. In den ehemaligen Luftfracht Hallen ist ein temporärer Freiraum entstanden. Menschen und Organisationen sind eingeladen, gemeinsam an der Stadt der Zukunft zu bauen und mit neuen Ideen und Konzepten zu experimentieren. https://www.amflughafen1.de/en;7, 11;platform/organizations/covers/dgstkvccv14vcc614hpo;Gebäude H / ZKSI Flughafen Tegel 1, 13405 Berlin;;;
Hotel Continental – Art Space in Exile;artspaceinexile.org;Hotel Continental – Art Space in Exile ist ein Zentrum für zeitgenössische Kultur in Berlin, das schutzsuchenden Künstlern aus der Ukraine und anderen Ländern, die unter Krieg und Verfolgung leiden, Arbeitsräume und eine Plattform zu bieten, um sich mit dem internationalen Publikum zu vernetzen. Daneben kuratiert Hotel Continental - Art Space in Exile sein eigenes thematisches Programm, fördert die künstlerische Zusammenarbeit zwischen Ländern Osteuropas und Berlin und leistet damit einen Beitrag zur kulturellen Diplomatie in Europa. Hotel Continental ist ein gemeinnütziges Projekt mit dem Ziel, einen Ort der Partizipation und Kooperation zu schaffen, getragen von den Idealen von Freiheit, Demokratie und einer offenen Gesellschaft. Hotel Continental - Art Space in Exile;10, 17;platform/organizations/covers/bgijz4vlfv7ke8vhtldt;Elsenstraße 87, 12435 Berlin;;;
Auftakt Berlin;auftakt.berlin;„Auftakt Berlin“ ist ein Networking-Event für Newcomer der Musikbranche. Ziel ist, einen stärkeren Zusammenhalt innerhalb der nächsten Generation zu schaffen. Kommunikation zwischen u.a. Künstler:innen, Verlagen und Musikmagazinen der Zukunft— gleich zu Beginn der Karriere. Bei „Auftakt Berlin“ muss also keiner bereits ‚relevant‘ sein. Hier geht es um die Förderung von jedem, der es mit der Musik ernst meint. In dem Sinne sind auch die Tickets kostenlos: Ab September kann sich jeder bewerben, der zwischen 18 und 25 Jahren und auf irgendeine Art in der Musikbranche tätig ist. Erfahrenere Branchenakteure werden zwar auch eingeladen, haben dann aber eher eine Mentorenfunktion. Das Event findet am 24.10.2024 erstmalig in Berlin Schöneberg statt. Da können die Newcomer dann — neben dem Knüpfen wertvoller Kontakte — kostenlose Einzelberatung beim Musikanwalt Kai Jüdemann beanspruchen, an Workshops teilnehmen, eine Live-Episode des feministischen Musikpodcasts „Furore On Air“ genießen, Keynotes anhören und vieles mehr. Weitere Mentoren oder Sponsoren sind auch weiterhin gern gesehen. Wer Newcomer unterstützen möchte kann sich gerne melden. https://www.linkedin.com/in/ella-urbach/ Instagram;1, 4, 5, 17;platform/organizations/covers/tzdl3mns083gh8m9ty6j;Martin-Luther-Straße 77, 10825 Berlin;;;
Holzbau der extra Klasse mit BAUCON;baucon-online.com;BAUCON ist ein mittelständisches Holzbauunternehmen mit dem Schwerpunkt Großprojekte im Holzbau zu leiten und auszuführen sowie Auftraggeber rund um die Planung im Holzbau zu beraten, die Planung einschließlich der Statik im Holzbau zu erstellen und die Lieferung und Logistik sowie Montage durchzuführen. Mit dem Sitz in Berlin tragen sie dazu bei mehr Bauherren, Architekten und Planer von den Vorteilen des Baustoffs Holz zu überzeugen. Denn mit dem Voranbringen des Holzbaus leistet BAUCON einen wertvollen Beitrag zum Erreichen der Sustainable Development Goals. In enger Zusammenarbeit mit starken Holzbaupartnern, Lieferanten, Produzenten treiben sie den Holzbau in Berlin voran. Dabei achten sie darauf, Holz und andere Materialien aus der Region zu beziehen, was nicht nur die Lieferketten verkürzt, sondern auch die lokalen Ressourcen unterstützt und die lokale Wirtschaft und Nachhaltigkeit fördert. Das gemeinsame Ziel ist es, den Holzbau weiterzuentwickeln und voranzubringen. BAUCON setzt auf Holz als umweltfreundliches und nachhaltiges Baumaterial und ist entschlossen, diese Botschaft zu verbreiten und den Holzbau in Berlin und darüber hinaus zu fördern.;9, 11, 12, 13, 17;platform/organizations/covers/mwkxadjcpatzl49lxq23;Kurfürstendamm 14, 10719 Berlin;;;
Berlin Center for Gene and Cell Therapies;bc-gct.com;Die Charité – Universitätsmedizin Berlin und die Bayer AG werden bis zum Jahr 2028 gemeinsam das Berlin Center for Gene and Cell Therapies errichten, einem Translationszentrum für transformative Gen- und Zelltherapien. Als Translation wird die Überführung von Forschungsergebnissen aus Wissenschaft und Forschung in die Gesundheitsversorgung bezeichnet. Ziel des gemeinsamen Vorhabens ist es, Gründer:innen von Start-ups dabei zu unterstützen, ihre innovativen Ansätze für Gen- und Zelltherapeutika in die klinische Entwicklung zu bringen und so neue Behandlungsmöglichkeiten für Patient:innen in Deutschland zu entwickeln. Das Potenzial für Gen- und Zelltherapien gilt als enorm. Sie sind Hoffnungsträger für Menschen, bei denen herkömmliche Therapien versagt haben oder für die es bislang keine wirksame Behandlung gibt. Das Zentrum wird aus einem sogenannten Inkubator mit voll ausgestatteten Laborflächen sowie aus einem Herstellungsbereich zertifiziert nach den Standards der guten Herstellungspraxis (Good Manufacturing Practice, GMP) bestehen. Für den Betrieb des Inkubators gründen Bayer und die Charité eine gemeinschaftliche öffentlich-private, nicht gewinnorientierte Gesellschaft mit beschränkter Haftung. Das Berlin Center for Gene and Cell Therapies vereinigt Forschung, Entwicklung und Herstellung von Gen- und Zelltherapien mitten in der Hauptstadt. Es soll am Bayer-Campus am Nordhafen entstehen. Durch die Einbettung in das Berliner Umfeld mit seiner Vielzahl an Einrichtungen der Biomedizin und Gesundheitswirtschaft soll es zu einem kreativen und interaktiven Hub für Biotech-Innovationen im Bereich neuartiger Therapien werden. Rund um den Standort des Zentrums kann so ein führendes internationales Biotech-Ökosystem für diese neuartigen Therapien wachsen. Das Projekt wird von der Bundesregierung sowie dem Land Berlin finanziell gefördert und unterstützt. Der Baubeginn ist für 2025 geplant. Mehr Informationen: https://www.bc-gct.com/;3, 4, 9;platform/organizations/covers/thnuo4iedtxbo98gkbxj;Föhrer Straße 15, 13353 Berlin;;;
Inklusive E-Bike Tour Friedrichshain-Kreuzberg;berlin.de;Der Bezirk Friedrichshain-Kreuzberg setzt sich ambitioniert für fairen und nachhaltigen Konsum (SDG 12) und stadtverträgliche Mobilität ein. Xhain ist Fairtrade-Bezirk und Vorreiter der ersten Pop-up Radwege in Berlin. Um diese Aktivitäten auch den Besucher:innen und Tourist:innen im Bezirk nahezubringen, hat das Bezirksamt gemeinsam mit fair spaces GmbH die entwicklungspolitische E-Bike Tour „Auf Spurensuche in Friedrichshain-Kreuzberg: mit dem E-Bike vom May-Ayim Ufer bis zu Fair Fashion“ entwickelt. Die Tour bietet eine neue Perspektive auf Xhain und lässt Besucher:innen entdecken, welchen Beitrag ein Bezirk beim Erreichen der globalen Nachhaltigkeitsziele leisten kann: z.B. durch den Einkauf von Pflastersteinen für den Mehringplatz, die unter menschenwürdigen Bedingungen produziert wurden, das Aufzeigen kolonialer Spuren im Bezirk oder durch die Bekämpfung des Klimawandels durch Zusammenarbeit mit internationalen Partnern. Weiterhin bekommen Teilnehmende einen Einblick, wo sie fair und nachhaltig produzierte Artikel erwerben können – vom fairen T-Shirt bis zum fairen Fußball und Sporttrikot.;4, 9, 11, 12, 15, 17;platform/organizations/covers/jarh1jfvvoiqvwvweprp;May-Ayim-Ufer, 10997 Berlin;;;
KlimaWerkstatt Spandau;berlin.de;Die KlimaWerkstatt Spandau bietet seit 2013 eine zentrale Plattform und Anlaufstelle, um Spandau auf dem Weg zur Klimaneutralität und einer nachhaltigen Entwicklung zu stärken. Sie unterstützt mit Ihren Angeboten alle interessierten Spandauer:innen, Initiativen, Einrichtungen, Vereine und lokale Unternehmen auf dem Weg zu nachhaltigen klimagerechten Lebens- und Arbeitsweisen. Mit vielfältigen Informations- und Bildungsangeboten, Beratungen, Veranstaltungen und Klimaprojekten in den Quartieren möchten wir eine Brücke vom Wissen zum Handeln schlagen und eine Plattform zur besseren Vernetzung für Spandauer Akteur:innen bieten. Denn: Gemeinsam und wissensbasiert kommen wir schneller und besser voran. Die Bewusstseinsbildung für wirksamen Klimaschutz und leicht umsetzbare praktische Angebote sind für unsere Arbeit essentiell. Dazu werden vier zentrale Handlungsfelder adressiert: Gebäude & effiziente erneuerbare Energie, emissionsfreie Mobilität, nachhaltiger Konsum & Ressourcenschutz, Klimaanpassung und nachhaltige Entwicklung mit den 17 SDGs als Querschnittsthema. Besonders beliebt sind unsere drei von Ehrenamtlichen betriebenen Repair Cafés, die rgelmäßigen Tauschveranstaltungen sowie die kostenlosen Energieberatungen in Kooperation mit der Verbraucherzentrale Berlin. Wir adressieren mit unseren Angeboten besonders die SDGs 7,11,12 und 13. Die KlimaWerkstatt ist ein Projekt der Stabsstelle für Nachhaltigkeit & Klimaschutz des Bezirksamts Spandau und wird ermöglicht durch die Unterstützung von vielen Spandauer Ehrenamtlichen und unseren Kooperationspartnern. Sie wird betrieben von der Stabsstelle Nachhaltigkeit & Klimaschutz des Bezirksamt Spandau. Ermöglicht wird unser Angebot vor allem durch das vielseitige Engagement von Ehrenamtlichen.;7, 11, 12, 13, 17;platform/organizations/covers/mua368ttcpj2tbbtcxgb;Mönchstraße 8, 13597 Berlin;;;
Berliner Spatzenretter;berliner-spatzenretter.de;Die BERLINER SPATZENRETTER sind eine gemeinnützige Initiative, die von zwei Kölnerinnen in Berlin lebend, 2018 gegründet wurde. Ziel ist es seitdem den Spatzenpopulationen deutschlandweit zu helfen und auf deren Nöte aufmerksam zu machen. Denn durch den Verlust an Lebensraum und Nistmöglichkeiten gehen die Haussperlingsbestände in Deutschland stetig zurück. In Städten wie Köln, Hamburg oder München sind die Spatzen kaum mehr da. Aktive Schutzmaßnahmen sind dringend erforderlich. Die Initiative BERLINER SPATZENRETTER setzt sich, zusammen mit Lehrern und Grundschulkindern, für den Schutz der Berliner Schulspatzen ein. Viele Berliner Schulen sind ein Paradies für Spatzen und bieten damit eine einzigartige Möglichkeit für eine praxisnahe Naturbildung direkt auf dem Schulgelände. Wir zeigen wie diese genutzt, erhalten und gefördert werden kann.;4, 11, 13, 15;platform/organizations/covers/pzhzdhm287opqgdzbxol;Choriner Straße 20, 10435 Berlin;;;
Berlins größte PV-Dachanlage auf den Messehallen am Funkturm;berlinerstadtwerke.de;Die Messe Berlin lässt auf ihren Hallendächern durch die Berliner Stadtwerke eines der größten deutschen solaren Dachkraftwerke errichten. Auf mehr als 20 Hallen des Geländes am Funkturm wird in den kommenden zwei Jahren auf einer Nutzfläche von ca. 50.000 Quadratmetern eine Anlage mit 15.000 Photovoltaik-Modulen und einer Gesamtleistung von ca. 6 MWp installiert. Mit der zukünftig produzierten Solarenergie vermeidet die Messe Berlin rund 1.900 Tonnen CO2 pro Jahr. Die Anlage ist ein wichtiger Baustein in der Nachhaltigkeitsstrategie, um den Betrieb von Großveranstaltungen in Zukunft klimaneutral zu organisieren. Der auf den Hallen erzeugte Strom von ca. 5 GWh pro Jahr soll zu einem Anteil von über 80 Prozent auf dem Gelände selbst genutzt werden. Rund 20 Prozent kann in das Stromnetz eingespeist werden.;11, 12, 13;platform/organizations/covers/npo5skazg0jgwvef1l3o;Messedamm 22, 14055 Berlin;;;
Lebensmittel retten und armutsbetroffene Menschen unterstützen - Die Berliner Tafel;berliner-tafel.de;Die Berliner Tafel ist die erste Tafel Deutschlands. Als sie 1993 gegründet wurde, konnte niemand ahnen, dass sich daraus eine der größten Sozialbewegungen Deutschlands entwickeln würde. Die Tafelidee ist so einfach wie überzeugend: Lebensmittel retten und armutsbetroffene Menschen unterstützen. Tafelarbeit bedeutet immer die Gleichzeitigkeit von Nachhaltigkeit und Solidarität. Der Bedarf ist immens: Die Berliner Tafel verteilt jeden Monat rund 660 Tonnen überzählige Lebensmittel an insgesamt 170.000 armutsbetroffene Menschen in der Hauptstadt. Der Verein unterstützt sowohl 400 soziale Einrichtungen als auch 48 Berliner LAIB und SEELE-Ausgabestellen mit Lebensmitteln (Stand 9/2023). Darüber hinaus engagiert sich die Berliner Tafel zum Thema Ernährungsbildung und bietet mit ihrem Kinder- und Jugendprojekt KIMBA Kochkurse für heranwachsende Generationen an.;1, 2, 3, 4, 10, 11, 12, 13;platform/organizations/covers/wdv6numcdayxlzk5chra;Beusselstraße 44, 10553 Berlin;;;
Neubau der Unternehmenszentrale der Berlin Hyp AG;berlinhyp.de;Die Berlin Hyp beabsichtigt ihren Standort in Berlins Mitte (Tiergarten) angepasst an Ihre Unternehmensstrategie nachhaltig auszurichten. Am Traditionsstandort – Budapester Straße 1 – soll die neue Unternehmenszentrale entstehen. Die aktuell in zwei verschiedenen Gebäuden untergebrachten Mitarbeitenden sollen zukünftig an einem Ort zusammengeführt werden. Beim Neubau wird mit dem dänischen Architekturbüro C.F. Møller Architects ein nachhaltiges und effizientes Flächenkonzept umgesetzt. Im Neubau soll Raum für insgesamt 500 Arbeitsplätze entstehen, hinzu kommt eine zentrale Versammlungsstätte, die Townhall, ein Konferenzbereich sowie eine Betriebsrestauration auf insgesamt 11 Vollgeschossen. Die Berlin Hyp wird den Neubau außerdem nach außen hin öffnen und ausgewählte Flächen noch stärker auch für öffentliche Events zur Verfügung stellen. Das bisherige Bestandsgebäude in der Budapester Straße 1 wurde bereits zurückgebaut – mit der Zielsetzung auch hierbei die höchsten Kriterien der Deutschen Gesellschaft für Nachhaltiges Bauen (DGNB) zu erfüllen. Als sogenannte Zwischenquartiere während der Bauphase nutzen wir derzeit unser weiteres Bestandsgebäude in der Corneliusstraße 7, welches wir seit 2020 sowohl räumlich (Realisierung neuer Arbeitswelten) als auch technisch (umfassende energetische Sanierung) in Gänze überholt sowie aus- und umgebaut haben. Darüber hinaus nutzen wir als zweites Zwischenquartier eine neu gestaltete und angemietete Bürofläche an der Tauentzienstraße / Ecke Rankestraße. Die Berlin Hyp legt besonderen Wert auf die Verwirklichung nachhaltigkeitsorientierter Ziele. Die Nachhaltigkeit der Architektur und Funktionalität der eigengenutzten Bestandsimmobilien am Standort Berlins soll die Ausgewogenheit ökonomischer, ökologischer und sozialer Belange mit langfristiger Werthaltigkeit in der Erstellung und im Betrieb unserer Gebäude darstellen. Ziel ist es, soweit wie möglich, die höchsten Kriterien der DGBN zu erfüllen. Ferner sind wir Unterstützer von MADASTER Deutschland und arbeiten an der Erfüllung der Erfordernisse der EU-Taxonomie. Dadurch möchten wir u.a. einen Beitrag zum Klimaschutz sicherstellen sowie einen hohen Nutzerkomfort und eine ressourcenschonende Material- und Baustoffverwendung gewährleisten. Die Berlin Hyp misst dem energieeffizienten Bauen vor dem Hintergrund des notwendigen Klimaschutzes einen hohen Stellenwert bei. Dies versuchen wir auch im Rahmen der Instandsetzung / Instandhaltung und Betrieb unserer im Eigentum befindlichen Gebäude unter Berücksichtigung wirtschaftliche und gestalterischer Anforderungen zu realisieren.;7, 9, 11, 13;platform/organizations/covers/rjuna6eax7f8l0xw2ctp;Budapester Straße 1, 10787 Berlin;;;
Ein Ort für alle – Barrierefreiheit im Strandbad Plötzensee;blog.unionhilfswerk.de;Die Besondere Wohnform “Joachim-Fahl-Haus”, ein Wohnheim für Menschen mit Behinderung, und das Strandbad Plötzensee sind direkte Nachbarn am Weddinger Nordufer. Man kennt sich, man mag sich, man hilft sich. Die Bewohner*innen vom Joachim-Fahl-Haus besuchen das Freibad und die schöne Strandbar am Plötzensee gern. Problematisch dabei ist, dass einige Bewohner*innen im Rollstuhl fahren oder stark mobilitätseingeschränkt sind. An den Strand, ans Wasser und zur Strandbar konnte man mit einem Rollstuhl bisher nicht fahren. Gemeinsam Barrieren abbauen Michel und Florian, die Strandbadpächter, stellen die Location, das Material und ihre Infrastruktur zur Verfügung. Die Unterstützenden des Unionhilfswerks bringen viel Engagement und Know-how in Sachen Inklusion und Barrierefreiheit mit. Bei einem großen Arbeitseinsatz letzen Jahres verlegten viele engagierte Helfer*innen einen Weg aus Panzerplatten. Insgesamt verlegten sie einen 250 Meter langen Weg aus einzelnen sechseckigen Panzerplatten über den Sandstrand. Letztes Jahr wurde somit der barrierefreie Weg zur Beachbar gebaut. Vor einigen Wochen wurde der Weg ergänzt, sodass es jetzt auch einen Weg zum Wasser gibt. Eine Unterwasserplattform für Rollstuhlfahrer*innen soll folgen. Außerdem wurde vor kurzem ein Strandrollstuhl angeschafft, mit extra Ballonreifen, damit er sich über Sand fahren lässt, und Korrosionschutz. Die Strandbadbetreiber wünschen sich, dass diese Nachmittage welche bereits im letzten Jahr gestartet sind zu „Vorzeige-Tagen der Inklusion” werden. Eine Gelegenheit und ein Anlass, dass sich Menschen mit und ohne Beeinträchtigungen an einem schönen Ort treffen, gemeinsam essen, feiern, schwimmen. An den inklusiven Strandtagen gibt es auf dem Gelände freiwillige Helfer*innen als Ansprechpartner*innen. Man erkennt sie an den gelben T-Shirts und Mützen. Sie helfen bei der Wegeleitung und Orientierung auf dem Gelände. Zudem gibt es ein inklusives Rahmenprogramm mit abwechslungsreicher Musik, Kreativ-, und Sportprogramm. Einige Highlights sind: die Kooperation mit Special Olympics Berlin, Sets von DJs des inklusiven Labels Ick mach Welle, DJ Andi sowie DJs der Inklusionsparties im Lido, Live-Auftritte von Supa Star Soundsystem, Yansn, DIRTYCOR und Graf Fidi, Public Viewing der EM-Spiele, Inklusives Stand Up Paddeln, ein inklusiver Tanzworkshop, Schmuck basteln, Henna Tattoos und vieles mehr. Kommende Termine für die inklusiven Strandtage: 14. Juni 2024 12. Juli 2024 09. August 2024 13. September 2024 Im besten Fall finden diese natürlich zukünftig noch öfter statt.;3, 4, 10, 17;platform/organizations/covers/nbzgce68ynw770dqldbk;Nordufer 26, 13351 Berlin;;;
