name;domain;description;sdgs;cover_image_id;street_address;Latitude;Longitude;
Lost Film – gemeinnützige Produktionsfirma;lostfilm.de;"Das Einzigartige Zusammenspiel von Genre-Film und Nachhaltigkeit Lost Film, eine gemeinnützige Produktionsfirma, setzt den Schwerpunkt auf Horror-Kurzfilme, die mit einem starken Fokus auf Nachhaltigkeit in Produktion und Kreativität erstellt werden. Das Unternehmen ist bestrebt, Filme zu produzieren, die nicht nur unterhalten, sondern auch zum Nachdenken anregen und wichtige gesellschaftskritische Themen beleuchten. Nachhaltige Filmproduktion als Unternehmensphilosophie Nachhaltigkeit ist bei Lost Film mehr als ein Schlagwort; es ist ein fundamentaler Teil der Unternehmensphilosophie. Das Ziel ist es, den ökologischen Fußabdruck zu minimieren, indem bewusst umweltfreundliche Drehorte ausgewählt und nachhaltige Produktionsmethoden angewendet werden, ohne dabei die soziale Verantwortung aus den Augen zu verlieren. Die Zukunft des Films liegt fest in der Überzeugung, dass ein verantwortungsvoller und umweltbewusster Ansatz entscheidend ist. Engagement für Talentförderung und Teilhabe Lost Film vertritt die Überzeugung, dass die Förderung neuer Talente entscheidend für die Zukunft der Filmbranche ist. Das Unternehmen setzt sich stark für Teilhabe und Partizipation in der Filmproduktion ein und schafft Plattformen für den Austausch und die Entwicklung junger Filmschaffender. Über die reine Filmproduktion hinaus engagiert sich Lost Film in der bildungspolitischen Arbeit und bietet ein breites Spektrum an Seminaren und Workshops an, um das Bewusstsein für nachhaltigen Film zu stärken. Das Engagement von Lost Film für Bildung zeigt sich auch in der Etablierung neuer Strukturen zur Unterstützung junger Talente. Das Ziel von Lost Film ist es, aufstrebende Filmschaffende durch gezielte Förderprogramme dabei zu unterstützen, ihre kreativen Visionen zu verwirklichen.";4, 5, 8, 10, 13;platform/organizations/covers/aqp8gcyi8dxdxmzluawb;Buttmannstraße 7, 13357 Berlin;;;
match.care;match.care;Digitale Rekrutierung und Integration von Fachkräften im Gesundheitswesen in Berlin;3, 8, 17;platform/organizations/covers/hix72r6mhyfjpdtyh9k6;Linienstraße 145, 10115 Berlin;;;
SLiM Smarte Logistik in Marienfelde;motzener-strasse.de;Aus eigenen Beobachtungen und nach mehreren Experimenten, bin ich zu Ergebnis gekommen, dass praktisch jeder von uns täglich ca.30-50% Trinkwasser einfach im Klo herunter spült.Das liegt in wesentlichen daran, dass das gesamte Abwasser unabhängig vom Verschmutzung Grad lediglich in ein Abwassersystem abgeleitet wird.Auch in betrieblichen Bereichen für technische Produktionszwecken in denen große Mengen sauberen Wassers gebraucht werden,wird häufig Trinkwasser eingesetzt, obwohl dieses in seinem Reinheitsgrad für den Zweck oft überqualifiziert ist.In der Konsequenz wird ein großer Teil des stark verschmutzten Brauchwassers wieder dem Abwasser zugeführt.Starke Verschmutzungen des Abwassers durch technische,aber auch bakterielle Belastungen (z.B. durch Fäkalien) machen die Abwasserreinigung hin zu adäquaten Trinkwasser teuer und kompliziert,in vielen Fällen kann das Wasser nicht zu 100% gereinigt und von Schadstoffen befreit werden und wird zudem in diesen Zustand häufig in offene Gewässer abgeleitet. Das hat mich auf Idee gebracht das relativ saubere Wasser von verschmutztes Wasser zu trennen und da mit die Belastung der Natur deutlich zu reduzieren.Die Idee besteht daraus das Wasser in zwei, voneinander unabhängigen, Kreisläufen zu nutzen und zu reinigen.Dieses System ermöglicht es ca. 50-70% an Trinkwasser zu sparen und Abwasser mit hohem Verschmutzung Grad bis 100% reduzieren. In Trinkwasser Kreislauf wird nur Wasser mit Trinkqualität geführt.Es ist geeignet für Körperpflege,zur Essenszubereitung, und um Geschirr und Wäsche mit umweltfreundliche Waschmitteln zu waschen.Dieses nur leicht verschmutzte Wasser wird in normalen Kläranlagen gereinigt (Num.2 auf dem Bild).Nach diesem Reinigung wird das Wasser zu erst zu Regenerationsanlage(Num.4 auf dem Bild)geleitet und danach für zusätzliche Reinigung durch natürlichen Sand, Aktivkohle oder anderen Absorber geführt, erst dann wird es weiter in freien Gewässer geführt(Num.5 auf dem Bild). Das technische Wasser bleibt immer in geschlossenen Kreis und verlässt diesen nur im Dampfzustand.Technisches Wasser wird für Toilettenspülung und Autowäsche genutzt und in verschiedenen technischen Betriebe in der Produktion eingesetzt(selbstverständlich nicht für die Lebensmittel, Medikamentenherstellung oder ähnliche Zwecke).Es ist außerdem geeignet zur Stromerzeugung, Metall Kühlung,Baustoffen Herstellung, für Heizungsanlagen und für andere technische Zwecke...Dises Wasser kann mit aggressiven Methoden wie chemische Reaktionen, Starkstrom, oder anderen ähnlichen Mitteln bis zu entsprechenden Standartnormen gereinigt werden(Num.3 auf dem Bild).Dieses Wasser kann für zusätzliche Sicherheit auch mit leichtem Duft, Farbe und unangenehmen Geschmack versehen werden, bevor es ins System geleitet wird.Leitungen,Hähne und anderen Zubehör in diesem Kreislauf werden auf bestimmte Standartnormen gefertigt, sodass ein anschließen an den Trinkwasserkreis unmöglich gemacht wird. Zusätzlich zu beiden Kreisläufen muss das Regenwasser aus den Städten von Verschmutzungen wie unter anderem von Autoöl, Schwermetallen, Mikropartikel aus Autoreifen, chemische Reagenten und anderen Verschmutzungen gereinigt werden. Gereinigtes Regenwasser wird auch durch Regenerationsanlage(Num.4 auf dem Bild)geleitet und nur dann kommt zu offene Gewässer(Num.5 auf dem Bild).;9, 11, 13, 17;platform/organizations/covers/lqm9oi1js3bwttkq8z6n;Motzener Straße 22, 12277 Berlin;;;
Grünes Kraftwerk;motzener-strasse.de;Im Projekt „Grünes Kraftwerk“ werden seit März 2022 die nachhaltig erzeugten Energiemengen der fünfzehn beteiligten Firmen am Standort in Marienfelde messtechnisch erfasst, aufbereitet und visualisiert. Durchschnittlich 43 % des Energiebedarfs werden in diesen Unternehmen umweltgerecht erzeugt. Das „Grüne Kraftwerk“ vernetzt digital insgesamt siebzehn Photovoltaikanlagen für die Stromerzeugung und sieben Installationen für umweltgerecht erzeugte Wärme, etwa durch Blockheizkraftwerke (BHKW), Holzpellet-Heizkessel, Wärmepumpen und Wärmerückgewinnungsanlagen aus der Produktion. Die installierten Energie-Zähleinrichtungen in den Unternehmen verfügen über Schnittstellen zur Datenfernauslesung. Per Funksignal (Lorawan) werden die Daten zur Energiegewinnung und zur CO2- Einsparung an ein Gateway mit Datenlogger und SIM-Karte übertragen und anschließend mit gesicherter Verbindung an eine Datenbank weitergeleitet. So präsentieren die Unternehmen ihre umweltfreundlich produzierten Strom- und Wärmemengen in Echtzeit auch auf einem öffentlich zugänglichen Internetportal. Bei den fünfzehn beteiligten Unternehmen handelt es sich um zwölf Produktionsunternehmen aus den Branchen Maschinenbau, Kunststoffverarbeitung, Metallbau, Medizintechnik, sowie der Fenster- und Möbelherstellung. Hinzu kommen noch drei Großhandelsunternehmen. Sie beschäftigten insgesamt mehr als tausend Mitarbeiter und haben ihren Standort teilweise seit Jahrzehnten im Industriegebiet Motzener Straße. Auch in Sachen Elektromobilität sind die Firmen aktiv und unterhalten derzeit 41 E-Ladestationen und 26 E-Autos. Mit ihrer Beteiligung an diesem Projekt zeigen die Unternehmen, dass sie es ernst meinen mit einer modernen und nachhaltigen Tätigkeit. Sie werben für eine stadtverträgliche Industrie und zugleich gehen sie mit diesem Einsatz für den Standort einen wichtigen Schritt zu einem intelligenten, smarten Industriegebiet der Zukunft. Die Senatsverwaltung für Wirtschaft hat dieses Projekt im Rahmen des Masterplan Industrie gefördert. Es ist in 2023 geplant, dieses Projekt sukzessiv auf weitere, schon vorhandene Anlagen im Industriegebiet auszudehnen. Gleichzeitig entsteht ein Anreiz und Werbeeffekt für den Ausbau der Erneuerbaren Energieproduktion bei weiteren Firmen im Industriegebiet. Im Startjahr 2022 (9 Monate) wurden in diesem Projekt 1,3 Millionen Kilowattstunden Strom und Wärme mit über 1 Million KG CO 2 Entlastung registriert. Die Daten können auf der Seite www.gruenes-kraftwerk.berlin jederzeit und laufend nachvollzogen werden.;7, 9, 11, 13, 17;platform/organizations/covers/omgyk4tlxxncjy1yvwok;Motzener Straße 22, 12277 Berlin;;;
Pilotprojekt Reinigungsstreife - BVG;nachgefragt.bvg.de;Mit großer Resonanz hat die BVG im Februar ihr Projekt „Reinigungsstreife“ auf der südlichen U8 gestartet. Nach drei Monaten Pilotbetrieb und einer umfangreichen Auswertung steht jetzt fest: Der Test war ein Erfolg. Deshalb geht es weiter, und das Projekt wird erheblich ausgeweitet. Ab sofort findet der verstärkte und gemeinsame Einsatz von Reinigungs- und Sicherheitskräften auf der gesamten Linie U8 statt – von Wittenau im Norden bis zur Hermannstraße im Süden. Und weil Sauberkeit und Wohlbefinden nur nachhaltig sind, wenn alle mitmachen, startet die BVG in Kürze eine neue Kampagne, die frech und „BVG-like“ daran erinnert, dass Dreck nicht von selbst entsteht und es unsere gemeinsame Aufgabe ist, Müll und Dreck zu vermeiden. Der Erfolg der Pilotphase bemisst sich vor allem an der fast ausschließlich positiven Resonanz der Fahrgäste. „Dies ist ein Projekt für Menschen“, sagte BVG-Vorstandsvorsitzender Henrik Falk. „Deshalb ist das, was die Menschen hier erleben und wahrnehmen, unser wichtigster Maßstab. Und damit das Ganze zu einem nachhaltigen Erfolg wird, brauchen wir eine schlagkräftige Allianz unterschiedlicher Akteurinnen und Akteure – und letztlich auch die aktive Unterstützung unserer Fahrgäste selbst.“ In der begleitenden Umfrage bewerteten unter den Online-Teilnehmer*innen 81 Prozent die Maßnahmen positiv. Weit über die Hälfte der vor Ort Befragten bewerteten die Sauberkeit an den Testbahnhöfen besser als zuvor. Sehr positiv wurden auch die bereits umgesetzten optischen Verschönerungen der Bahnhöfe aufgenommen, insbesondere die Gestaltung der Bauzäune am Bahnhof Kottbusser Tor. Zugleich bestätigen aber auch die ersten objektiven Zahlen die positive Tendenz. Die durch Sicherheitskräfte festgestellten Vorfälle gingen im Projektzeitraum um mehr als 75 Prozent zurück. Den weiteren Weg geht die BVG nicht allein. Als starker Partner für den zukünftigen Erfolg ist mit der Erweiterung die Deutsche Bahn an Bord. An den Umsteigebahnhöfen zwischen U- und S-Bahn soll es künftig eine enge Zusammenarbeit geben, damit Fahrgäste sich im gesamten Bahnhof wohl fühlen können. Weitere Kooperationen im Bereich Sauberkeit sind geplant. Die Zusammenarbeit mit der Polizei wurde noch einmal deutlich intensiviert. In Projektphase zwei ist nun auch die Direktion 1 mit an Bord. Und auch im sozialen Bereich konnten bestehende Kontakte bereits ausgeweitet und erste konkrete Maßnahmen zu einer noch engeren Zusammenarbeit vereinbart werden. Wunsch der BVG ist es, dass die Sicherheitskräfte künftig noch intensiver geschult werden, um jederzeit angemessen und professionell auch mit Menschen umgehen zu können, die obdachlos, psychisch krank oder abhängig von Drogen oder Alkohol sind. Die Gespräche mit der Berliner Stadtmission über die zukünftige Zusammenarbeit dazu sind bereits fortgeschritten. Gemeinsam mit der Kältehilfe wird zukünftig außerdem die „Shelter Map“ ausgegeben, auf der Menschen, die Schutz oder Hilfe benötigen, alle wichtigen Anlaufstellen schnell und unkompliziert finden. Fotos: BVG, Andreas Süß;12, 13, 17;platform/organizations/covers/yoazbya8egvbn1iy44iq;Hermannstraße 12, 12049 Berlin;;;
Nachhaltige Veranstaltungen mit VATERBLUT;nachhaltig.vaterblut.com;Mit über 30 Jahren Erfahrung in der Livekommunikation und als von visitBerlin in der höchsten Kategorie zertifizierter Sustainable Partner hat VATERBLUT einen eigenen Bewertungs- und Auswertungs-Leitfaden entwickelt, der Kriterien für nachhaltiges Management und unternehmerische Nachhaltigkeit vermittelbar und messbar macht. Der Leitfaden ist integrativ, anwendungsorientiert und bereits vielfach erprobt. Er basiert auf den Listen des Umweltbundesamtes sowie des BMUV und bezieht alle Aspekte der Nachhaltigkeit mit ein. Als prägende Agentur für Kommunikation möchte VATERBLUT mit positiven Anregungen inspirieren, anspornen und zum Handeln motivieren. Nicht dogmatisch, immer visionär und immer für Mutter Erde. Voll öko! Voll sozi! Voll fair! Nicht nur qualitativ, sondern auch quantitativ wertet VATERBLUT die Maßnahmen und die CO2 -Emissionen von Veranstaltungen aus. Die von VATERBLUT entwickelte Auswertung beinhaltet Checklisten für alle Partner von Veranstaltungen, ist nach Handlungsfeldern geclustert und farblich codiert. Sie erfüllt Dokumentationsparameter für eine Zertifizierung nach ISO 20121 (Nachhaltiges Veranstaltungsmanagement). Auf Wunsch erstellt VATERBLUT einen Nachhaltigkeitsbericht. Darin werden die Daten analysiert sowie Anregungen, Optimierungspotenzial und Empfehlungen zu mehr CO2-Reduktion benannt. Die Nutzung der Checklisten ist kostenlos. Damit will VATERBLUT einen wirklichen Beitrag zu mehr Klimagerechtigkeit im MICE-Bereich leisten.;3, 6, 7, 12, 13, 14, 15, 17;platform/organizations/covers/vkjxy3siwyhsbdb2x0ym;Im Marienpark 47, 12107 Berlin;;;
CO2 in Abbruchbeton dauerhaft speichern – erste Anlage Europas in Berlin;neustark.com;Das Schweizer Climate-Tech-Unternehmen neustark hat eine wegweisende Lösung entwickelt, um den weltweit größten Abfallstrom, den Abbruchbeton, in eine CO2-Senke zu verwandeln. Im September 2023 eröffnete neustark gemeinsam mit dem Bau- und Recyclingunternehmen Heim die erste europäische CO2-Speicheranlage in Berlin. Wie funktioniert das Ganze? Der Prozess beginnt damit, dass CO2 aus Biogasanlagen gewonnen und zu nahegelegenen Speicheranlagen transportiert wird. Dort wird das CO2 mit dem Abbruchbeton in Kontakt gebracht, wobei es zu einer chemischen Reaktion kommt und das CO2 in Kalkstein umgewandelt wird. Somit wird das CO2dauerhaft im Abbruchbeton gespeichert und der Atmosphäre entzogen. Dieses carbonatisierte Abbruchbetongranulat kann dann im Straßenbau oder zur Herstellung von Recycling-Beton verwendet werden. Für die Berliner Anlage verwendet neustark CO2 aus der Bioabfallvergärungsanlage von MVV in Dresden-Klotzsche. Der überschüssige CO2-Ausstoß wird von Landwärme übernommen und von neustark zur Speicheranlage bei Heim transportiert und entfernt. Ein wichtiger Aspekt der Wertschöpfungskette ist die Generierung von Klimazertifikaten durch die erbrachte Speicherleistung. Diese werden an Unternehmen mit ehrgeizigen Klimazielen verkauft, um ihnen bei der Reduzierung schwer vermeidbarer Emissionen zu helfen. Microsoft und UBS gehören zu den Kunden von neustark im Bereich der CO2-Entfernung. Die Berliner Anlage kann mehr als 1.000 Tonnen CO2 pro Jahr dauerhaft speichern, und neustark plant, bis 2030 eine Million Tonnen CO2 zu entfernen. Das Unternehmen expandiert derzeit in Europa und hat neben den bereits zwölf in Betrieb genommenen Anlagen fünfzehn weitere Projekte in der DACH-Region und Frankreich in Bau. Neustark arbeitet eng mit lokalen und globalen Baustoffrecyclern zusammen, um die maximale CO2-Entfernungswirkung zu erzielen. Die Berliner Speicheranlage und die Partnerschaft mit Holcim sind wichtige Meilensteine in der Firmengeschichte von neustark als Pionier im Bereich Carbon Removal.;9, 11, 13;platform/organizations/covers/o59bi8rrg7wismkyo6xl;Bitterfelder Straße 23a, 12681 Berlin;;;
NIRGENDWO Umweltbildungs- & Kulturort im Wriezener Park;nirgendwo-berlin.de;Ort der Stadtnatur, Erlebnis- & Lernort für Natur-, Umwelt-, Klima- und Nachhaltigkeitsbildung, Kulturort und -bühne & nachhaltiger Veranstaltungsort NIRGENDWO Umweltbildungs- & Kulturort im Wriezener Park;3, 4, 11, 12, 13, 14, 15, 16, 17;platform/organizations/covers/myxhpaxqpadt2226nfaz;Helsingforser Straße 10, 10243 Berlin;;;
Neue Wege in der Wiederverwendung: Gebrauchtwarenkaufhaus NochMall;nochmall.de;„Re-Use statt wegwerfen“ heißt es seit 2020 in Reinickendorf. Auf 1.500 Quadratmetern bietet die „NochMall“, das BSR-Gebrauchtwarenkaufhaus, Möbel, Kleidung, Elektrogeräte, Haushaltswaren, Spielzeug, Bücher und vieles mehr. Hinzukommt ein vielseitiges Workshop- und Eventangebot, das Re-Use noch mehr erleb- und erfahrbar werden lässt. Auf Recyclinghöfen gerettet, auf Kieztagen gesammelt oder direkt vor Ort in Reinickendorf abgegeben: Viele Wege führen gutes Gebrauchtes in die NochMall. Denn viele Dinge müssen nicht achtlos weggeworfen werden, sondern dürfen gern nochmal(l) verwendet werden. Die NochMall ist das erste Kaufhaus für Gebrauchtwaren in Berlin, das viel mehr ist als ein Secondhand-Kaufhaus: In der NochMall wird gutes Gebrauchtes wie Möbel, Kleidung, Elektrogeräte, Haushaltswaren, Spielzeug, Bücher und vieles mehr auf über 1.500 Quadratmetern verkauft. Als Beitrag zum Zero-Waste-Leitbild Berlins ist die NochMall der Erlebnisort für Kreislaufwirtschaft und Abfallvermeidung mit rund 50 Mitarbeiter:innen und bis zu 1.300 Besucher:innen täglich. Dafür bietet die NochMall Trendsettern, Initiativen und Unternehmen die Möglichkeit ihre nachhaltigen Produkte zu präsentieren, organisiert Repaircafés und Upcycling-Workshops und bietet Veranstaltungen mit Vorreiterinnen und Vorreitern aus der Re-Use- und Umweltszene an. Unter dem Stichwort „Green Services“ finden sich in der NochMall zirkuläre Dienstleistungen, wie die Beschichtung alter Pfannen oder die Reinigung verschmutzter Sneakers, um ihre Lebensdauer zu verlängern. Seit diesem Jahr bietet die NochMall auch einen Liefer- und Abholservice für Möbel und andere gut erhaltene sperrige Gegenstände an.;9, 11, 12, 13;platform/organizations/covers/icik1p3a5blpyate4ra9;Auguste-Viktoria-Allee 99, 13403 Berlin;;;
our greenery;ourgreenery.com;Unser Greenery ist ein engagiertes Team leidenschaftlicher Visionär*innen, das es sich zur Aufgabe gemacht hat, den entscheidenden Faktor für unser Wohlbefinden, unsere Langlebigkeit und Lebensfreude – unsere Ernährung – für alle zugänglich und unkompliziert zu machen. Wir bei Our Greenery sind fest davon überzeugt, dass eine gesunde und nachhaltige Ernährung der Schlüssel zu einem erfüllten Leben ist. Deshalb setzen wir alles daran, dir die besten Möglichkeiten zu bieten, deine Essgewohnheiten auf einfache und wirkungsvolle Weise zu verbessern. Lass uns gemeinsam den Weg in eine gesündere und glücklichere Zukunft gehen.;2, 3, 9, 11, 12;platform/organizations/covers/jlltjbukeufrkicyhu1h;Flughafen Tegel 1, 13405 Berlin;;;
Radbahn Berlin - Paper Planes;paper-planes.net;;3, 7, 9, 11, 13;platform/organizations/covers/qgoov4gdvmsv6zrw3zw7;Forster Straße 52, 10999 Berlin;;;
regioloop – Papier von hier;pinguindruck.de;regioloop steht für einen nachhaltigen Papierkreislauf, hier wird Altpapier in Berlin und Brandenburg gesammelt, daraus bei der Papierfabrik Leipa in Schwedt (Brandenburg) Recyclingpapier hergestellt, das dann in Druckereien wie dem Druckhaus Sportflieger, Pinguin Druck und Printprinz in Berlin regional zu Ihren Drucksachen verarbeitet wird. Recycling-Papier ist der wichtigste Baustein für eine umweltschonende Druckproduktion, effizientester und nachhaltigster Rohstoff der Kreislaufwirtschaft, ressourcenschonend spart dieser 40% Wasser und 60% Energie gegenüber der Papierproduktion aus Frischfaser und ist mindestens 10-mal recycelbar. Um Papier möglichst effektiv und häufig zu recyceln, ist auch die Auswahl einer umweltfreundlichen Druckproduktion wichtig.;12;platform/organizations/covers/soguyi7u6qrw9ivxrpeb;Marienburger Str. 16, 10405 Berlin;;;
PLANT A SEED;plantaseeed.de;„PLANT A SEEED“ ist das erste wissenschaftliche Nachhaltigkeitsprojekt für Großkonzerte in Deutschland. Initiiert von The Changency in Zusammenarbeit mit der Band Seeed und Berliner Hochschule für Technik, untersuchte das Projekt bei fünf ausverkauften Seeed-Konzerten in der Berliner Parkbühne Wuhlheide die ökologischen und sozialen Auswirkungen solcher Events. Jeder der fünf Konzerttage widmete sich einem spezifischen Fokusthema: soziale Nachhaltigkeit, Konsum und Beschaffung, Ernährung, Mobilität sowie Ressourcen und Klima. Ziel war es, das Bewusstsein der rund 85.000 Konzertbesucher*innen für Nachhaltigkeit zu schärfen, durch diverse Maßnahmen Inspiration für eine klimagerechtere Livemusik-Branche zu bieten und durch Datenerhebung und Klimabilanzierung Wissen für die gesamte Branche zu generieren. So wurden allein durch das Einsammeln von über 3.200 Zigarettenkippen etwa 3,25 Millionen Liter Wasser vor potenzieller Verschmutzung geschützt.;11, 12, 13, 17;platform/organizations/covers/fw3tit1pillitxwdz2xs;An der Wuhlheide 187, 12459 Berlin;;;
Ausbauhaus Südkreuz;praegerrichter.de;Gemeinschaftlich. Ökologisch. Bezahlbar. Im Rahmen des Konzeptverfahrens „Schöneberger Linse“ hat die Baugruppe 2019 den Zuschlag für das Grundstück erhalten. Eine Mischung aus Eigentumswohnungen, geförderten Mietwohnungen und kiezgebundenem Gewerbe ist auf 6 Etagen untergebracht. Der über die gesamte Breite der Fassade laufende Austritt und die bodentiefen Holzfenster erweitern den Wohnraum großzügig nach außen. Neubauten von heute werden in Zukunft nicht mehr abgerissen und entsorgt, sondern materialbewusst modernisiert oder umgebaut. Darum sind die Materialien des in Holz-Beton-Hybridbauweise errichteten Gebäudes adäquat zu ihrem Lebenszyklus eingesetzt: Die im dichten urbanen Kontext positionierte dauerhafte Tragstruktur ist in Beton errichtet und ermöglicht auf Dauer eine hohe Nutzungsflexibilität. Die Fassade ist komplett als rückbaubare Holzkonstruktion ausgeführt und mit vorvergrauter Lärchenschalung vor der Hinterlüftungsebene verkleidet. Der Innenausbau der Wohnungen als kurzlebigster Teil des Hauses wurde weitestgehend verbundstofffrei und mit nachwachsenden Baustoffen umgesetzt. Für die Zimmerwände in den Wohnungen wurde nach diesen Prinzipien eigens eine trocken montierbare Holzständerwand entwickelt. Die Materialien werden sicht- und lösbar verschraubt, gelegt, gesteckt und können wieder abmontiert und an anderer Stelle wieder eingesetzt werden. Oberflächen bleiben teilweise unbehandelt oder werden wohngesund lasiert. So wird zukünftig der einfache Umbau von tragwerkunabhängigen Bauteilen oder bei einer Modernisierung eine sortenreine Trennung der Materialien möglich.;10, 11, 12, 13;platform/organizations/covers/qtz8mlagooqsjeguntne;Gotenstraße 45, 10829 Berlin;;;
QuerKlang;querklang.eu;QuerKlang – Experimentelles Komponieren in der Schule ist ein deutschlandweit einzigartiges Konzept der kulturellen Bildung. Es vereint das kulturell-künstlerische Fundament unseres Gemeinwesens mit den Grundwerten unseres demokratischen Miteinanders. Kinder und Jugendliche lernen mit Student:innen künstlerischer Fachdisziplinen sowie Künstler:innen der Freien Szene und Lehrer:innen den experimentellen Umgang mit Geräuschen und Klängen. Sie lernen musikalisches Material gemeinsam forschend zu entdecken, zu erkunden und zu kombinieren. Hierbei steht die eigene kreative Produktion im Spannungsverhältnis zu kollektiven künstlerischen demokratischen Aushandlungs- prozessen. QuerKlang arbeitet konsequent prozesshaft, künstlerisch-experimentell, ergebnisoffen und persönlichkeitsbildend. Alle Teilnehmer:innen (Kinder, Jugendliche und Erwachsene) stehen im Zentrum des Denkens und Handelns. QuerKlang setzt an den individuellen musikalisch-künstlerischen Erfahrungswelten aller Teilnehmenden (Klassenverbände aller Klassenstufen und Schulformen) an und arbeitet barrierefrei. Alle Zugänge und Erfahrungsräume haben in den experimentellen kommunikativen Strategien des künstlerische Formates gleiche Wertigkeit und gleiche Verbindlichkeit. QuerKlang eignet sich damit hervorragend, die heterogenen Lebenswelten, Kommunikations- und Ausdrucksformen der zunehmend digitalisierten Generationen zu öffnen, erlebbar zu machen und über die gemeinsame kreative Zusammenarbeit in einen Austausch zu treten. Hierbei bestehen weite Freiräume für künstlerischen und kreativen Eigensinn. Eigene Qualitätskriterien werden gemeinsam entwickelt und in dem klasseninternen Kontext ebenso diskutiert, verteidigt und verhandelt, wie mit den anderen beteiligten Schulgruppen (gemeinsame Vorkonzerte aller Beteiligten) und zuletzt auch der Öffentlichkeit (Uraufführung der eigenen Kollektivkomposition). Im Rahmen des gemeinschaftlichen Prozesses sind die prägenden und zentralen Themen des gemeinsamen reflexiven Diskurses das Partizipationspotenzial, die Prozessqualität, die Ergebnisoffenheit und der multiperspektivische Ansatz.;4, 16;platform/organizations/covers/gxa3tqdrf9q5b6xctfie;Crellestraße 22, 10827 Berlin;;;
