name;domain;description;sdgs;cover_image_id;street_address;Latitude;Longitude;
Fensterkraftwerk;fensterkraftwerk.de;Das Fensterkraftwerk sammelt Sonnenenergie vom Fenster in der Wohnung. Jeder kann es installieren und selbst Strom ernten. Meine Vision Wir möchten allen Menschen eine eigene Stromproduktion ermöglichen, unabhängig davon wo sie wohnen. Das Fensterkraftwerk ist dafür die Lösung. In Deutschland leben die Menschen zum größten Teil als Mieter:innen in Städten und dort in Wohnungen von Mehrfamilienhäusern. Eine eigene PV-Anlage auf dem Dach ist daher für die meisten keine Option. Die Alternative: Ein Balkonkraftwerk. Ist aber der Balkon nach Norden ausgerichtet oder verschattet oder überhaupt keiner am Haus angebracht, ist das keine Option. Fast jede Wohnung hat jedoch Fenster mit außenliegenden Fensterbänken und Laibungen (das ist der Fachbegriff für die Außenrahmen der Fenster) mit einer Ausrichtung nach Süden, Osten oder Westen. Diese ungenutzten Flächen eignen sich sehr gut zur Gewinnung von Solar-Energie. Damit kannst du deine eigene Energie erzeugen und verbrauchen. Im nächsten Schritt sollen noch Speicherlösungen realisiert werden, die effizient mit dem Fensterkraftwerk kommunizieren und die erzeugte Energie auch in der Nacht verfügbar machen (z.B. zur Versorgung der Grundlast wie dem Kühlschrank). Installierte Systeme Ich selbst habe in meiner Wohnung bereits Fensterkraftwerke im Einsatz. Diese produzieren mehr als 10% meines Strombedarfes. Ein wichtiger Effekt ist allerdings auch, dass ich mich durch die Eigenproduktion so intensiv mit dem Thema Energie beschäftigt habe, dass ich unseren Familien-Energieverbrauch erheblich senken konnte und dies sowohl für die Wärmeenergie als auch den Strom. Jeweils haben wir sicher die Hälfte an Energie im Vergleich zu den Vorjahren eingespart. Der gleiche Effekt tritt auch bei Freunden und Nachbarn auf, denen ich bereits Fensterkraftwerke montiert habe. Ich denke sogar, dass der Einspareffekt am Ende den größten Mehrwert für die Energiewende mitbringt. Deshalb habe ich per Kickstarter eine Firma finanziert, die dieses Thema nun Deutschlandweit behandelt. Wir wollen das Fensterkraftwerk ähnlich Salonfähig machen wie das Balkonkraftwerk und damit vielleicht sogar noch mehr Menschen erreichen und diese Menschen Energiesensitiver zu machen.;7, 11, 12, 13;platform/organizations/covers/civm87pqwdqkmwv9g6ad;Gneisenaustraße 45, 10961 Berlin;;;
bARlinietta;filmphilharmonie.de;„Unorte“ Berlins werden mit einem Augmented Reality Orchester, der „bARlinietta“ zu neuen Erfahrungs- und Erlebnisorten. Mittels einem mobile Device kann man Musiker-Musikerinnen sehen und hören. Dadurch erhalten Orte in Berlin, an denen sonst jeder achtlos vorbeigeht, eine neue emotionale Umdeutung. Durch die Kraft der Musik und die digitalen Musiker-Musikerinnen kann jeder Winkel der Stadt neu gedacht werden, ohne dass man baulich eingreifen muss. Niederschwelliger Zugang. Das kann als Spiel gestaltet werden oder als Stadtspaziergang durch die Stadt. Ein Orchester, Band, Musiker-Musikerinen werden aufgenommen und mittels einer Augmented Reality App sicht- und hörbar. Die Orte werden z.b. mit einem QR Code versehen. Jeder, der die App geladen hat, kann dann nachsehen, welche Band oder Orchester an diesem „Unort“ spielt. Das ganze in 3D. Die QR Codes können z.b. an den Telekomkästchen angebracht sein, Wenn der Spaziergänger oder Spaziergängerin darum weiß, wird er oder sie sich auf die Suche machen und immer neue Orte finden wollen, um nachzusehen wer dort spielt. Dadurch wird Berlin eine Stadt der Musik. Wir haben diese Idee in der Coronazeit entwickelt. Es kam noch nicht zur Umsetzung. Ein Rahmen vion 10 Jahren sollte eine ausreichende Entwicklungszeit sein. Auch für die Finanzierung. Klar ist, dass in den nächsten 10 Jahren, Städte auch digital erlebbar sein werden. Berlin mit der „bARlinietta“ (Arbeitstitel) könnte darin zur Vorreiterin werden.;1, 4, 5, 11, 12, 17;platform/organizations/covers/luhl89mpye07azu5sqlz;Herbert-von-Karajan-Straße 1, 10785 Berlin;;;
FLUSS BAD BERLIN;flussbad-berlin.de;Fluss Bad Berlin ist ein nachhaltiges Stadtentwicklungsprojekt. Es sieht eine gemeinwohlorientierte Nutzung des etwa 1,9 km langen, ungenutzten Spreekanal in der Stadtmitte Berlins vor. Der innerstädtische Fluss soll im abgegrenzten Areal des Kupfergrabens in der historischen Mitte Berlins – von Monbijoubrücke bis Fischerinsel – als öffentlicher Raum neu erlebbar werden für alle Menschen in der Stadt. Dafür wird der Verein Flussbad Berlin seit 2015 im Rahmen des Bundesprogramms Nationale Projekte des Städtebaus zur weiteren Entwicklung und Vermittlung des Vorhabens durch Bund und Land gefördert und das Areal von der Museumsinsel bis zur Fischerinsel im Jahr 2019 per Senatsbeschluss als Stadtumbaugebiet „Umfeld Spreekanal“ ausgewiesen. Die positiven Effekte für eine Metropole sind in der Umsetzung des Fluss Bad Projektes vielschichtig und umfangreich zugleich: Die Stadtmitte gewinnt eine riesige blaue Erholungsfläche zurück, zum Schwimmen, Flanieren, Sitzen am Wasser, Genießen und Ausruhen. Eine ungenutzte Wasserverkehrsstraße wird zum Aufenthaltsraum und lässt die historische Stadtmitte auf ganz neue Weise erlebbar werden. Fluss Bad Berlin etabliert einen sozialen, diversen und kostenfreien Ort für alle Menschen. Die historische Mitte bekommt damit die Chance, zu dem Ort zu werden, der für die Diskussion großer relevanter Themen unserer Zeit steht – wie Wasser als Gemeingut, Diversität der Gesellschaft, Resilienz im Klimawandel, Lebensqualität. Flankiert wird Fluss Bad Berlin durch eine fundierte Forschung zur Wasserqualität der Spree in enger Zusammenarbeit mit den Berliner Wasserbetrieben und dem Kompetenzzentrum Wasser Berlin, mit dem Ziel, die Wasserqualität weiter zu verbessern und mittels Wasserfilterung sichtbar zu reinigen. Bis diese Maßnahmen greifen, soll der Projekteinstieg aber bereits durch eine provisorische und abgegrenzten Badestelle im Spreekanal gelingen. Grundlage ist ein gemeinsam mit dem Kompetenzzentrum Wasser Berlin entwickeltes Prognosesystem zur Ermittlung der Wasserqualität (https://www.badberlin.info/). Das System zeigt an, wann das Wasser auch heute schon sauber genug zum Schwimmen ist und wann der Zugang temporär gestattet werden kann.;6, 11, 13, 14;platform/organizations/covers/usur4ate9jitnpicoesu;Unterwasserstraße 10-9, 10117 Berlin;;;
Digitale Mobilitätsdienste für Radfahrende mit KIS’M;fokus.fraunhofer.de;Fraunhofer FOKUS setzt in KIS’M digitale Mobilitätsdienste für Radfahrerende um, beispielsweise eine Grüne-Welle-Assistenz, um mehr Komfort und Sicherheit für alle Verkehrsteilnehmende zu ermöglichen. Zentral für solche Services ist eine genaue Ortung und eine stets aktuelle digitale Straßenkarte. Um dies für ganz Berlin zu erreichen, unterstützt Fraunhofer FOKUS die Stadt Berlin bei der (teil-)automatisierten Aktualisierung der digitalen Karte. Zudem integriert Fraunhofer FOKUS teleoperiertes Fahren für automatisierte People-Mover für eine schnelle Einführung auf der letzten Meile insbesondere am Stadtrand. Auf dem Gelände des Innovationscampus »Berlin TXL – Urban Tech Republic« (UTR) des ehemaligen Flughafens Tegel startete 2022 das Kooperationsprojekt KIS’M unter Federführung der Senatsverwaltung für Umwelt, Mobilität, Verbraucher- und Klimaschutz (SenUMVK) zur Erprobung von automatisierter und vernetzter Mobilität.;9, 11, 13;platform/organizations/covers/u4ss8geawnb6vrwynhx3;Kaiserin-Augusta-Allee 31, 10589 Berlin;;;
Barrierefreiheit digital mit everGuide;fokus.fraunhofer.de;Barrierefreiheit innerhalb von Gebäuden – sei es im Krankenhaus, Bahnhof, Flughafen, einer Behörde, in einem Einkaufszentrum oder in einem großen Firmenkomplex – ist Teil der Global Goals. Mit der hochpräzisen Indoor-Navigation vom Fraunhofer-Institut FOKUS wird dies allen Menschen – egal ob mit oder ohne Sehbeeinträchtigungen – auf dem Smartphone ermöglicht. Die herkömmliche GPS-basierte Navigation auf dem Smartphone, wie sie aus dem Straßenverkehr bekannt ist, funktioniert in regulären Gebäuden nicht. Hier hilft das digitale Indoor-Navigationssystem everGuide. Mit seiner hohen Genauigkeit bei Position und Blickrichtung führt es die Nutzerinnen und Nutzer sicher und zuverlässig ans Ziel und ist gleichzeitig günstig in Anschaffung und Wartung. Die am Fraunhofer FOKUS entwickelte und zum Patent angemeldete Lösung bietet eine Genauigkeit von unter einem Meter bei geringen Installations- und Wartungskosten. Sie ist so präzise, dass blinde Personen sicher geleitet werden können. Unser Indoor-Navigations-System funktioniert offline, d. h. ohne permanente Internet-Verbindung auf jedem modernen Smartphone und ist in allen App-Stores zum Download verfügbar.;9, 10;platform/organizations/covers/yh4hz79p3yoyml9kpwkk;Kaiserin-Augusta-Allee 31, 10589 Berlin;;;
Food Campus Berlin;foodcampus.berlin;Die ökologischen Grenzen unseres Planeten sind überschritten. Die Lebensmittelindustrie ist Teil des Problems, aber sie kann auch Teil der Lösung sein. Wir bauen einen physischen und digitalen Ort als Transformationsbeschleuniger, ein ganzes Ökosystem aus Startups, Unternehmen und Wissenschaft. Der Food Campus Berlin wird ein Sprungbrett für Lösungskonzepte und gleichzeitig eine Bühne für Innovationsprojekte der Lebensmittelbranche. Wissenschaftler:innen, Köch:innen, Lebensmitteltechnolog:innen, Food-Nerds, Techies, Bauer:innen und Food-Handwerker:innen arbeiten Hand in Hand an Konzepten für die Welt von morgen und die Menschen von heute. Mit dem Food Campus Berlin entsteht ein Ökosystem der Ökosysteme. Ein Transformationsbeschleuniger, der Konzepte fördert, die auf Wissen und Vernunft basieren und die Versorgung und Wertschöpfung im Auge behalten, die gut für den Planeten und gut für die Menschen sind.;2, 9, 13, 17;platform/organizations/covers/sjhawtp3lxfcxshht3om;Giesebrechtstraße 20, 10629 Berlin;;;
Future Products (Medienproduktion);f-products.de;Future Products ist eine Zusammenarbeit von Produzierende und Regieführende Personen mit dem Ziel, eine nachhaltige Filmindustrie aufzubauen. Darüber hinaus widmen wir uns wichtigen Themen wie psychischer Gesundheit, Belästigung am Arbeitsplatz und Nachhaltigkeit und setzen uns für branchenweite Verbesserungen über unsere eigenen Projekte hinaus ein. Unser Erfahrungsschatz hat uns die Herausforderungen dieser Branche vor Augen geführt und uns dazu motiviert, effektivere und fairere Verhältnisse anzustreben.;1, 3, 4, 5, 12, 13, 17;platform/organizations/covers/qlqjm8n9wqr8axojkjdm;Siemensstraße 71, 12247 Berlin;;;
Friedensfahrt 4.0;friedensfahrt.webflow.io;Die Friedensfahrt 4.0 ist der Versuch mit Hilfe von Sport und Kultur den Zusammenhalt zu stärken und Anlässe für Austausch und ein neues Miteinander im ländlichen Raum zu stärken. Es geht darum Solidarität mit den Initiativen und Menschen zu zeigen, die sich für Demokratie und Teilhabe im Osten einsetzen. Dafür soll ein Tour durch den Osten beginnend in Berlin auf die Beine gestellt werden. Ein Radrennen für ambitionierte Amateur:innen, eine Fahrradwanderung für groß und klein. Über verschiedene Etappen geht es durch den Osten. An jedem Etappenort soll darüberhinaus ein Kulturprogramm mit lokalen Akteur:innen auf die Beine gestellt werden. Musik, Theater, Kunst und Austausch erweitern das Vorhaben und sollen so für einen Impuls sorgen, der für mehr gesellschaftlichen Zusammenhalt wirbt. Ein Sport- und Kulturerlebnisse zur Aktivierung gesellschaftlichen Engagements ALLER füreinander. Ziel der Umsetzung ist der Frühsommer 2025. Mehr dazu: Friedensfahrt 4.0;1, 3, 12, 13, 15, 17;platform/organizations/covers/jdep0whvsgf2poec3uxr;Genslerstraße 13055 Berlin;;;
Startup Villa FU;fu-berlin.de;"Mehr als 30 Jahre lang - von 1912 an - wurden in der Altensteinstraße 40 in Berlin-Dahlem die Umlaufbahnen der Sterne und Planeten berechnet. Seit Ende 2018 wird das Gebäude als Inkubator für Ausgründungen an der Freien Universität Berlin genutzt. Merh als 20 Startups wurden hier zuletzt auf ca. 1.000 m² Nutzfläche beherbergt. Das Gründerhaus heißt nun offiziell ""Startup Villa der Freien Universität Berlin"".";4, 8, 9, 17;platform/organizations/covers/rjopn4aybb8hngf6l9ip;Altensteinstraße 40, 14195 Berlin;;;
Initiative Rosi: Chemoambulanz in der Charité Berlin neu gedacht;fuer-rosi.de;Jahr für Jahr erkranken Abertausende Frauen an Krebs die sich einer Chemotherapie unterziehen. Wir arbeiten mit unserer Initiative Rosi daran, die Räume so umzugestalten, dass diese Zeit über das Medizinische hinaus zu wertvoller Lebenszeit wird. Was ist unser Ziel? Wir möchten aus Wartezeit Lebenszeit machen. Wir schaffen ein heilsames und wohltuendes Umfeld für Frauen. Dazu bedarf es eines ganzheitlichen Ansatzes, der neben Ruhe, Rückzug und Geborgenheit auch Inhaltliches bietet: Lern- und Begegnungsmöglichkeiten, in denen Betroffene sich nicht nur als Behandelte, sondern auch als Handelnde erleben und selbstbestimmt und selbstwirksam positive Strategien und Perspektiven entwickeln können.;3, 4, 17;platform/organizations/covers/ceukbjawwj6upuxupzj4;Mittelallee 9, 13353 Berlin;;;
Projekt Antonia – Solar und Geothermie sorgen für grüne Energie;gasag-solution.de;Im Auftrag des Projektentwicklers urban space hat die GASAG Solution Plus ein komplett CO₂-neutrales Energiekonzept für das Gebäude mit 25 Wohnungen und zwei Gewerbeeinheiten entwickelt. Sowohl die Beheizung als auch die Kühlung der 2.250 m² in der Antonienstraße am südlichen Rand des Bezirks Reinickendorf werden ausschließlich über erneuerbare Energien gewährleistet. Für die zu 100 Prozent erneuerbare Wärme- und Kälteversorgung kommen modernste Technologien zum Einsatz: 14 Erdsonden mit 98 m Tiefe und zwei Sole-Wasser-Wärmepumpen sorgen für wohlige Wärme im gesamten Gebäude. Mithilfe der Erdsonden unterhalb der Tiefgarage kommt die umweltfreundliche und verlässliche Geothermie zum Einsatz. Dabei wird die vorhandene Wärme aus der Erde gezogen und mithilfe der Wärmepumpen auf die notwendige Vorlauftemperatur für Fußbodenheizung und Warmwasserbereitung gebracht. Auch die Wärmeverteilung erfolgt klimaneutral, denn: Die beiden Sole-Wasser-Wärmepumpen werden mit Strom aus den Photovoltaik-Anlagen auf dem Dach des Hauses betrieben. Der Clou: Im Sommer funktioniert das System genau andersherum: Kühle steigt aus dem Erdreich auf und sorgt über die Fußbodenheizung für eine angenehme Temperatur in den Räumen. So sind keine stromintensiven Klimaanlagen nötig. Damit ist die Wärme- und Kälteversorgung des gesamten Objekts gänzlich CO₂-neutral.;3, 7, 11, 13;;EUREF-Campus 23, 10829 Berlin;;;
Generationenhaus Holländergarten – Grüne Energie statt fossiler Brennstoffe;gasag-solution.de;Mit dem Generationenhaus Holländergarten betreut GASAG Solution Plus ein Neubauprojekt mit einem besonderen Anspruch an generationengerechtes Wohnen – auch mit Blick auf die Energieversorgung. Eigentümerin des Objekts ist die Stadtbürgergenossenschaft e.G., eine Eigentümergenossenschaft, die ein Mehrgenerationenhaus im Berliner Nordwesten errichtet. In zwei Wohngebäuden entstehen auf insgesamt rund 3.600 m² 44 Wohneinheiten, ein Coworking-Space und ein Gemeinschaftsraum. Zunächst war für die Wärmeerzeugung- und -verteilung in den Gebäuden eine konventionelle Energieversorgung über eine Gasanlage und ein Blockheizkraftwerk (BHKW) geplant. Die Energiekrise 2022 ließ die Eigentümergemeinschaft aber umdenken: Gibt es eine fossilfreie Wärmelösung, die sowohl günstiger als eine Erdgasversorgung als auch klimaneutral ist? GASAG Solution Plus nahm die Herausforderung nur zu gerne auf und dachte das ganze Projekt trotz bereits begonnener Baumaßnamen nochmal neu mit dem Ziel, eine klimaneutrale Wärmelösung zu realisieren. „Das war nicht ganz trivial, da der Bau des Gebäudes schon begonnen hatte. Wir haben aber einen guten Weg gefunden, ein Konzept für eine effiziente und erneuerbare Energieversorgung im Generationenhaus Holländergarten zu entwickeln und umzusetzen“, erklärt Jochen Hein, verantwortlicher Projektleiter bei GASAG Solution Plus. Am Ende ist das grüne Wärmekonzept nicht nur nachhaltiger, sondern auch preiswerter als eine herkömmliche Versorgungslösung. Für die Genossenschaftsmitglieder, die das Mehrgenerationenhaus bauen, stand bei der Entscheidungsfindung aber nicht nur der Preis im Vordergrund, sondern auch das Ideal einer lebenswerten, grünen Zukunft für nachfolgende Generationen. Mit der klimafreundlichen Energielösung haben sich die Eigentümer für Versorgungs- und Zukunftssicherheit entschieden.;3, 7, 11, 13;;EUREF-Campus 23, 10829 Berlin;;;
Balu – Adopt a pet;getbalu.com;Balu unterstützt Tierheime bei der Vermittlung ihrer Haustiere. Auf der Vermittlungsplattform können Interessenten schnell und übersichtlich Hunde und Katzen aus deutschen Tierheimen in ihrer Umgebung entdecken und ihnen ein neues Zuhause schenken. Jedes Jahr finden mehr als 100.000 Tierheimtiere kein neues Zuhause. Die Vision von Balu ist es, für jedes Tier aus dem Tierschutz ein passendes Zuhause zu finden. Integrierte Fragebögen sorgen für gezieltere Anfragen und erleichtern den Tierheimen die Vorauswahl geeigneter Interessenten. So finden Nutzer schneller den passenden Vierbeiner, und die Tierpfleger:innen haben mehr Zeit, sich um ihre Tiere zu kümmern. Neben der eigenen Vermittlungsplattform engagiert sich Balu gemeinsam mit seinen Partnern durch vielfältige Aktionen für den Tierschutz. Als exklusiver Partner des Deutschen Tierschutzbundes arbeitet Balu eng mit Expert:innen aus dem Tierschutz zusammen, um eine nachhaltige digitale Lösung für die Tiervermittlung zu entwickeln. Mehr Informationen: Balu – Adopt a pet;15, 17;platform/organizations/covers/sny5da1bwwfd0vd3csvn;Lottumstraße 13A, 10119 Berlin;;;
Gewerbe Solar;gewerbe-solar.com;Unser Fokus liegt auf der Realisierung von Photovoltaikprojekten im Gewerbebereich, einschließlich der Planung, Entwicklung und Installation von Solarparks. Mit unserer langjährigen Erfahrung und Expertise bieten wir Ihnen effiziente und nachhaltige Lösungen, die nicht nur Ihren Energiebedarf decken, sondern auch einen positiven Beitrag zum Umweltschutz leisten ‍;7, 9, 12;platform/organizations/covers/r0wpufxtnybjycmztp5a;Flughafen Tegel 1, 13405 Berlin;;;
Gieß den Kiez;giessdenkiez.de;Das Projekt Gieß den Kiez unterstützt die Stadtverwaltung sowie engagierte Bürger:innen bei der Koordinierung der Bewässerung von Berliner Stadtbäumen. Die kartenbasierte Webanwendung erfreut sich einer wachsenden ehrenamtlichen Community und wird seit Mai 2020 vom CityLAB Berlin – dem Innovationslabor der Hauptstadt – betreut. Das CityLAB ist ein Projekt der Technologiestiftung Berlin und wird von der Senatskanzlei gefördert. Als interaktive Karte bildet Gieß den Kiez derzeit über 830.000 Straßen- und Grünanlagenbäume Berlins (Stand November 2023) ab. Bürger:innen können sich über die Bäume in der Nachbarschaft informieren, eintragen, wann sie wie viel gegossen haben und auf Gieß den Kiez Patenschaften für Bäume übernehmen.;3, 6, 11, 13, 15;platform/organizations/covers/mvsmeskimzzdhkaaxevp;Grunewaldstraße 61-62, 10825 Berlin;;;
"100.000 Regenwasser-Tankstellen für die ""essbare Schwammstadt""";globalgoalsberlin.de;"Grundidee: Jeder Berliner, egal wo in der Stadt, soll nicht weiter als 50 Meter bis zur nächsten ""Regenwasser-Tankstelle"" gehen müssen, um ebenerdig seine Giess-Ambitionen für (s)ein Stück Stadtgrün erfüllen zu können. Dazu notwendig: Ein (Senats-)Programm zur MASSIVEN Ausstattung der Stadt mit großvolumigen Wassersammelbehältern (ab 1m³), die als Teil gemeinwohlorientierter Daseinsfürsorge alle 100 Meter / Straßenseite an den Dachabläufen / Hauswänden aufgestellt werden (Berlin hat rund 5.000 Straßen-Kilometer x 2 Seiten = 10.000 x 1 Tonne / 100 Meter = 100.000 Tonnen als theoretische Ideal-Zahl / Fix-Stern). Damit entsteht in Verbindung mit der symmetrisch notwendigen Basis-Initiative von Anwohnern eine essentielle Infrastruktur zum Umsetzen vieler ansonsten ungedacht (bzw. ungemacht) bleibender Möglichkeiten: Bäume, Baumscheiben, Fassaden- & Hofbegrünung, u.a.m.: Vieles würde denk- & machbar und ganz nebenbei entstünden um diese „Potential-Generatoren“ Nachbarschafts-Kooperations-Möglichkeiten von nach oben offenen Größenordnungen - ganz im Sinne der Expo-Maxime: Menschen vernetzen! Und: Berlin zur essbaren Schwammstadt machen!!! Zusätzlich positiver Nebeneffekt: Kanalentlastung bei Starkregen-Ereignissen. [N.B.: Dies ist „nur“ eine Vision (im April 2023 eingereicht zum „Schwammstadt-Wettbewerb“ der Regenwasser-Agentur [siehe Idee Nr. 70 im Reader: https://regenwasseragentur.berlin/wp-content/uploads/2023/06/Einreichungen-Wettbewerb-10-Ideen-fuer-die-Schwammhauptstadt.pdf]) und (noch) kein – außer in winzigen Anfängen – bereits bestehendes Projekt. (Derzeit existieren in ganz Berlin erst vielleicht zwei Dutzend solcher Wassertanken.) Die Vision ist aber SO einfach / realistisch umsetzbar, dass es - als Expo-Projekt gewählt – das Finanz- & Resonanz-Potential entfalten kann, dass zu seiner Entwicklung bis 2035 nötig wäre und Berlin damit zu einer Vorreiterrolle für einen transformierten Allmende-Begriff führen kann, ohne den eine gesunde und lebenswerte Stadt in Zeiten des Klimawandels nicht möglich sein wird.]";3, 11, 13;platform/organizations/covers/ffionaphzn4buu3xqeav;Neue Jüdenstraße 1, 10179 Berlin;;;
Charité Competence Center for Traditional and Integrative Medicine (CCCTIM);globalgoalsberlin.de;Gesundheit natürlich nachhaltig denken Das Charité Competence Center for Traditional and Integrative Medicine (CCCTIM) konzentriert sich auf die Erforschung und Evidenzgenerierung der sicheren und effektiven Anwendung von Naturheilkunde und traditioneller Medizin. Traditionelle Medizin hat nicht nur zur Entdeckung lebensrettender Wirkstoffe, wie dem mit dem Nobelpreis ausgezeichneten Artemisinin und vieler pflanzlicher Medikamente beigetragen, sondern auch Praktiken wie Meditation, Yoga und Fasten hervorgebracht, die weltweit Anerkennung finden und in Deutschland von mehr als 70 Prozent der Bevölkerung angewendet werden. Für 80 Prozent der Weltbevölkerung ist traditionelle Medizin die erste Wahl oder sogar die einzige Option und weltweit führende Kliniken integrieren zunehmend naturheilkundliche Methoden. Berlin kann an dieser Entwicklung mitwirken. Das CCCTIM hat das Ziel, in Zusammenarbeit mit dem WHO Global Traditional Medicine Centre (Catalysing ancient wisdom and modern science for the health and well-being of people and planet), evidenzbasierte Therapien der Naturheilkunde und traditionellen Medizin auf dem neuesten Stand der Wissenschaft weiterzuentwickeln, die die Lebensqualität verbessern sowie eine ganzheitliche, nachhaltige Gesundheitsversorgung und Prävention für alle fördern.;3, 9, 12, 17;platform/organizations/covers/fvybjekzysnlaf4swt5d;Augustenburger Platz 1, 13353 Berlin;;;
M.ICC – MOBILITY HUB BERLIN;graftlab.com;Das Internationale Congress Centrum (ICC) in Berlin-Westend ist das größte Kongresszentrum in Europa und eines der größten der Welt. Seit April 2014 ist dieses gefeierte Epizentrum der Pop-Architektur geschlossen, mögliche Nachnutzungen werden in einer breiten öffentlichen Debatte diskutiert. Um das Gebäude vor dem Abriss zu bewahren, initiierte GRAFT ein Netzwerk von Befürwortern und Partnern aus Berlin (Trockland, GRAFT Brandlab, Art+Com, Arcadis, Drees & Sommer und viele mehr), um ein nachhaltiges Gestaltungskonzept zu entwickeln, das die Zukunft des Gebäudes als wichtige Mobilitätsdrehscheibe und Innovationsbeschleuniger sichert. Es schlägt vor, das ICC in das M.ICC zu verwandeln: das Mobility Innovation Convention Center. Das M.ICC wird zukunftsweisende Lösungen anbieten, um das ungenutzte Potenzial des Komplexes zu realisieren und die Herausforderungen der Gegenwart anzugehen. Mit Blick auf einen der verkehrsreichsten Verkehrsknotenpunkte Berlins – das westliche Tor der Stadt – sowie die ehemalige AVUS-Rennstrecke ist das ICC der perfekte Ort für neue Visionen der Mobilität. Das gemeinsam von GRAFT und Trockland entwickelte Konzept für den leerstehenden Koloss am westlichen Stadteingang sieht ein Museum für Motorsportgeschichte, ein Mobilitätserlebniszentrum und die Realisierung der größten E-Ladestation Berlins vor. Aus langjähriger Erfahrung in internationalen Projekten mit führenden Akteuren im Bereich der Mobilität wie Volocopter, E.ON und Mercedes-Benz weiß GRAFT um die Anforderungen und Chancen neuer Mobilitätskonzepte. Mit neuer Nutzung und neuem Leben wird diese Architekturikone nicht nur Europas größte Indoor-Kongressfläche und eine zentrale Drehscheibe für zeitgemäße Mobilitätslösungen bieten, sondern auch ein Ort sein, an dem Menschen, Wissen und innovative Technologien mit der Welt verbunden werden. „Mobilität bedeutet Forschung, Experimente und Zukunftsoptimismus zugleich. Im Bestand des Berliner Kultgebäudes ICC entwirft GRAFT ein umfassendes Nutzungskonzept, das für alle Generationen zugänglich ist.“;4, 9, 11, 17;platform/organizations/covers/qjgddu5hfdt91mmxctow;Invalidenstraße 5, 10115 Berlin;;;
